Headline,Posted
"Centre to select new chiefs for ONGC, BPCL and IOC "," September 02, 2010"
Max India chief considering selling EIH stake ," September 02, 2010"
Sensex surges 235 points ," September 02, 2010"
‘State on fast track development' ," September 02, 2010"
"Sensex surge on better growth concerns, higher export "," September 01, 2010"
Stocks edge down on global cues ," September 01, 2010"
RIL notifies fourth gas strike in KG Basin ," August 31, 2010"
UB Group has no plans to sell stake in MCF: Mallya ," August 31, 2010"
UB Group has no plans to sell stake in MCF: Mallya ," August 31, 2010"
Sensex down 61 points despite higher GDP ," August 31, 2010"
"RIL buys 14.12 % stake in EIH for Rs.1,021 crore "," August 31, 2010"
NTPC offers 49% stake to Qatar Petroleum ," August 31, 2010"
"RIL buys 14.12 % stake in EIH for Rs.1,021 crore "," August 30, 2010"
Improper use of food coupons ," August 30, 2010"
LNG hopes spur State power plans ," August 30, 2010"
Improper use of food coupons ," August 29, 2010"
Down's Syndrome does not deter them ," August 29, 2010"
Down's Syndrome does not deter them ," August 29, 2010"
Mukesh Ambani elected to WEF Foundation Board ," August 28, 2010"
Mukesh Ambani elected to World Economic Forum Foundation Board ," August 27, 2010"
Ray of hope ," August 27, 2010"
Ray of hope ," August 27, 2010"
Ray of hope ," August 27, 2010"
Ray of hope ," August 27, 2010"
Ray of hope ," August 26, 2010"
Sensex advances by 47 points in choppy trade ," August 26, 2010"
Case against merger of firms ," August 25, 2010"
West Bengal makes rapid strides in industrial development ," August 25, 2010"
Weak global trends drag Sensex down by 98 points ," August 24, 2010"
Sensex posts marginal gains ," August 24, 2010"
"L&T bags two orders worth Rs 1,195 cr from ONGC "," August 23, 2010"
"Sensex gains 8 pts; consumer durables, PSUs see heavy buying "," August 23, 2010"
Sensex sheds 53 points ," August 21, 2010"
SEBI rejects RIL’s consent appeal on insider trading issue ," August 20, 2010"
Sensex ends 53 points lower ," August 20, 2010"
Sensex rallies to 30-month high on strong global cues ," August 20, 2010"
Sensex rises by 198 points to over 30-month high ," August 19, 2010"
Alcatel-Lucent to beef up broadband services ," August 19, 2010"
Stocks ," August 19, 2010"
Alcatel-Lucent to beef up broadband services ," August 19, 2010"
House panel coming on August 28 ," August 19, 2010"
Tech News ," August 18, 2010"
Markets report ," August 18, 2010"
Sensex closes flat at 18049 ," August 18, 2010"
TECH NEWS ," August 18, 2010"
Protest against RIL gas pipeline proposal ," August 17, 2010"
Sensex sheds over 100 points ," August 17, 2010"
Kalam inaugurates Sensors Research Society ," August 16, 2010"
NTPC may offer stake to Qatar in Kayamkulam plant ," August 16, 2010"
Sensex gains 93 points; SBI scales new peak ," August 13, 2010"
Making films on his terms ," August 13, 2010"
All praise for Reliance social activity ," August 13, 2010"
Making films on his terms ," August 12, 2010"
Sensex ends flat in choppy trade as SBI cap losses ," August 12, 2010"
Sensex surrenders 150 points ," August 12, 2010"
NBFC stocks rise as RBI moots new banking licenses ," August 11, 2010"
NBFC stocks rise as RBI moots new banking licenses ," August 11, 2010"
Gas supply sought for 4 power projects ," August 11, 2010"
Gas supply sought for 4 power projects ," August 10, 2010"
Sensex down by 67 points ," August 10, 2010"
“Get more industrial investments from UK” ," August 10, 2010"
“Get more industrial investments from UK” ," August 10, 2010"
"Sensex advances 143 points; realty, auto biggest gainers "," August 09, 2010"
Bharti Airtel number one telecom company: Survey ," August 06, 2010"
Sensex sheds 29 points on negative U.S. jobs data ," August 06, 2010"
RIL buys 60 % in Marcellus Shale ," August 06, 2010"
Bangalore today ," August 06, 2010"
RIL rises over 1 p.c. on U.S. shale gas asset buyout ," August 05, 2010"
Sensex gains 103 points to highest level in over 30 months ," August 04, 2010"
Copies of charge sheet served to RIL officials ," August 04, 2010"
Profit booking pares gains ," August 04, 2010"
Copies of charge sheet served to RIL officials ," August 03, 2010"
Profit booking pares gains ," August 03, 2010"
GAIL first quarter net rises to Rs. 886 cr ," August 02, 2010"
Court to hear Reliance call masking case on Tuesday ," August 02, 2010"
FBI access to e-mail and Web records raises fears ," July 30, 2010"
IRDA to issue IPO norms for general insurance in two months ," July 30, 2010"
Sensex closes 124 points below ," July 30, 2010"
‘Calculated risk-taking vital for entrepreneurs' ," July 30, 2010"
Sensex gains 35 points ," July 30, 2010"
Sensex gains 35 points ," July 30, 2010"
‘Calculated risk-taking vital for entrepreneurs' ," July 30, 2010"
Sensex up 35 points; RIL down for second day ," July 29, 2010"
Sensex surrenders 120 points ," July 29, 2010"
India’s June crude production up 6.8% ," July 28, 2010"
Sensex surrenders 120 points ," July 28, 2010"
"RIL net profit increases 32 % to Rs. 4,851 crore "," July 28, 2010"
"RIL net profit increases 32 % to Rs. 4,851 crore "," July 27, 2010"
Sensex opens 57 points higher on RBI credit policy day ," July 27, 2010"
Sensex snaps gaining streak ," July 26, 2010"
"Braving charges, CBI to confront accused with evidence "," July 26, 2010"
"Braving charges of its ``misuse'', CBI to confront Amit Shah with evidence "," July 25, 2010"
EGoM meet on gas deferred by a day ," July 25, 2010"
AITUC convention from today ," July 24, 2010"
We must charge polluters to cut carbon: Australia ," July 23, 2010"
from the diary ," July 22, 2010"
"Metal, auto stocks help Sensex recovery "," July 22, 2010"
Sensex snaps three-day decline; closes up 100 points ," July 21, 2010"
High Court pulls up Reliance Industries ," July 21, 2010"
High Court pulls up Reliance Industries ," July 21, 2010"
Sensex ends 50 points down amid weak global trend ," July 20, 2010"
Sensex drops 27 points ," July 20, 2010"
Sensex closes 27 points below ," July 19, 2010"
Mukesh Ambani in key U.N. group ," July 19, 2010"
buylines ," July 19, 2010"
Mukesh Ambani in key U.N. group ," July 19, 2010"
"Focus on five areas, says Kalam "," July 17, 2010"
Lecture series ," July 16, 2010"
Massive arrangements for DMK's job fair ," July 16, 2010"
Sensex sheds 29 points in choppy trade as funds realign portfolios ," July 15, 2010"
Vimal introduces anti-microbial fabric ," July 15, 2010"
Vimal introduces anti-microbial fabric ," July 15, 2010"
ONGC to invest $4.05 billion on harnessing gas from UD-1 ," July 14, 2010"
"RIL moves CIC, says PSUs acting as cartel in ATF supply "," July 14, 2010"
"Sensex snaps 4 day gaining streak, ends lower by 48 points "," July 14, 2010"
Sensex up 49 points on RIL push ," July 14, 2010"
"IOC, BPCL, HPCL to cartelise price of de-regulated petrol "," July 13, 2010"
"Infosys Q1 net down 8.48% at Rs 1,488 crore "," July 13, 2010"
Sensex up 49 points on RIL push; Infosys down over 3% ," July 13, 2010"
"Sensex touches 18,000 on eve of earnings season "," July 12, 2010"
8 Indian firms on Fortune 500 list ," July 12, 2010"
Lofty ambitions rekindle interest in retailing ," July 12, 2010"
Lofty ambitions rekindle interest in retailing ," July 11, 2010"
8 Indian companies on Fortune 500 list ," July 11, 2010"
Urbane avenues beckon ," July 11, 2010"
Urbane avenues beckon ," July 10, 2010"
Deepwater drilling gets more time ," July 09, 2010"
Combined stock quotes ," July 09, 2010"
Combined stock quotes ," July 09, 2010"
Deepwater drilling gets more time ," July 09, 2010"
Deepwater drilling gets more time ," July 08, 2010"
Petrol prices may change every fortnight ," July 08, 2010"
Sensex recovers to close 181 points higher ," July 08, 2010"
Sensex surrenders 143 points ," July 08, 2010"
Ambanis’ revised gas supply pact valid only till 2022 ," July 07, 2010"
Sensex surrenders 143 points ," July 07, 2010"
Reliance says no to gas supply contracts beyond 60mmscmd ," July 06, 2010"
IOC starts buying Cairn’s Rajasthan crude oil ," July 06, 2010"
Cairn's Mangala fields output crosses 1-lakh barrel-mark ," July 06, 2010"
Sensex ends little changed ," July 06, 2010"
RNRL to merge with Reliance Power ," July 05, 2010"
RNRL to merge with Reliance Power ," July 05, 2010"
Agricultural engineers are in great demand ," July 05, 2010"
Raja suggests EGoM on TRAI report ," July 04, 2010"
RNRL to merge with Reliance Power ," July 04, 2010"
ONGC to intensify work on Western offshore fields ," July 03, 2010"
Sensex sheds 48 points ," July 03, 2010"
ONGC to intensify work on Western offshore fields ," July 03, 2010"
"OMCs to invest Rs.1,500 crore for LPG supply in Karnataka "," July 02, 2010"
Anil Ambani group firms RNRL and Reliance Power to merge ," July 02, 2010"
"Sensex ends a dull day, 48 points down "," July 02, 2010"
Bangalore today ," July 02, 2010"
"Sensex ends a dull day, 48 points down "," July 02, 2010"
Bangalore today ," July 02, 2010"
Taxmen seek fund details from three IPL teams ," July 01, 2010"
Sensex recovers 167 points ," July 01, 2010"
Cement major ACC’s MD Sumit Banerjee resigns ," June 30, 2010"
Sensex recovers 167 points ," June 30, 2010"
Sensex plummets 240 points ," June 30, 2010"
Remembering ‘a Brahmin without caste' ," June 30, 2010"
Sensex plummets 240 points ," June 29, 2010"
"India, Canada sign civil nuclear deal "," June 29, 2010"
Reliance Industries finds oil in Cambay Basin ," June 29, 2010"
Sensex posts 200-point gain ," June 29, 2010"
Fuel price deregulation is here to stay ," June 27, 2010"
Fuel price deregulation is here to stay ," June 27, 2010"
It's a bear run out there ," June 26, 2010"
LDF calls dawn-to-dusk hartal today ," June 26, 2010"
Ambani brothers sign gas supply pact ," June 26, 2010"
"RIL, RNRL sign gas supply pact "," June 26, 2010"
"RIL, RNRL sign gas supply pact "," June 25, 2010"
Sensex sheds 156 pts after govt raises fuel prices ," June 25, 2010"
RIL to acquire 45 % interest in Pioneer Natural's asset ," June 25, 2010"
Sensex declines on global cues ," June 25, 2010"
Sensex declines on global cues ," June 25, 2010"
RIL to acquire 45 % interest in Pioneer Natural's asset ," June 25, 2010"
It's a bear run out there ," June 25, 2010"
Sensex declines on global cues ," June 25, 2010"
RIL to acquire 45 % interest in Pioneer Natural's asset ," June 25, 2010"
Sensex recovers early losses ," June 24, 2010"
APIIC chief optimistic on investment flow to State ," June 24, 2010"
Sensex recovers on fag-end buying; Maruti leads gains ," June 23, 2010"
"Oil prices, fiscal deficit major challenges: Pranab "," June 23, 2010"
BWA winners pay spectrum fees ," June 23, 2010"
BWA winners pay spectrum fees ," June 22, 2010"
"Oil prices, fiscal deficit major challenges: Pranab "," June 22, 2010"
IMG Reliance to promote Indian basketball ," June 22, 2010"
Combined quotes of BSE and NSE ," June 22, 2010"
"Reliance Broadcast Network, CBS Corp join hands "," June 20, 2010"
RIL plans to add more space for retail venture ," June 20, 2010"
Saying it with stones ," June 20, 2010"
Saying it with stones ," June 20, 2010"
RIL: power business a natural extension ," June 19, 2010"
Saying it with stones ," June 19, 2010"
Reliance Industries halts 7-day rally in Sensex ," June 19, 2010"
RIL: power business a natural extension ," June 19, 2010"
Competition Commission to Raavan's rescue ," June 19, 2010"
"Day in pictures - June 18, 2010 "," June 18, 2010"
RIL shares slip on BSE ," June 18, 2010"
RIL to supply natural gas to ADAG plants: Mukesh ," June 18, 2010"
RIL shares slip on BSE ," June 18, 2010"
RIL to supply natural gas to ADAG plants: Mukesh ," June 18, 2010"
Sensex ends 45 points lower ," June 18, 2010"
Mukesh to detail growth plans to RIL shareholders tomorrow ," June 17, 2010"
"Sensex continues gaining spree, rises 154 points "," June 17, 2010"
Top 100 firms pay 18.7 % more advance tax ," June 17, 2010"
CNG prices hiked by Rs 5.60 per kg in Delhi ," June 16, 2010"
"IOC, HPCL inks pact with RIL for supply of natural gas "," June 16, 2010"
Cairn starts crude oil supplies through pipeline ," June 16, 2010"
Sensex recovers from early losses ," June 16, 2010"
Cairn starts crude oil supplies through pipeline ," June 16, 2010"
"Sensex rises for fifth day, adds 74 points "," June 15, 2010"
RCom to demerge Reliance Infratel ," June 15, 2010"
The combined quotes of BSE & NSE ," June 15, 2010"
RCom to demerge Reliance Infratel ," June 15, 2010"
Sensex climbs 273 points on global cues ," June 15, 2010"
Growth of Vaishnavism in Andhra Pradesh ," June 15, 2010"
UPA pampering corporates: Tapan Sen ," June 15, 2010"
Sensex surges to six-week high led by Reliance group stocks ," June 14, 2010"
CEOs earning crores in salaries ," June 14, 2010"
Ambanis holiday together in South Africa ," June 14, 2010"
CEOs earning crores in salaries ," June 14, 2010"
Tech transfer between Dow-Reliance expedited to please Dow?  ," June 13, 2010"
Only Mani Ratnam knows my potential: Abhishek ," June 13, 2010"
Bhopal remediation issue retards trade: CEO forum ," June 12, 2010"
Sensex regains 17000-mark ," June 12, 2010"
RIL makes sixth oil discovery in Cambay basin ," June 12, 2010"
"BWA auction: Centre to get Rs. 38,617 crore "," June 12, 2010"
Reliance Industries to acquire Infotel Broadband ," June 12, 2010"
Tasting success ," June 12, 2010"
Bhopal remediation issue retards trade: CEO forum ," June 11, 2010"
RIL discovers more oil in Cambay Basin ," June 11, 2010"
Reliance Industries to acquire Infotel Broadband ," June 11, 2010"
Oil regulator approves Ambani firm pipeline tariff ," June 11, 2010"
"BWA auction: Centre to get Rs. 38,617 crore "," June 11, 2010"
"Sensex soars to 17,000 points level "," June 11, 2010"
"BWA auction: Centre to get Rs. 38,617 crore "," June 11, 2010"
"Sensex soars to 17,000 points level "," June 11, 2010"
BSE says no manipulation in RIL plunge ," June 09, 2010"
"The social question, who cares? "," June 09, 2010"
"L&T, Hindalco among six new SEZs "," June 09, 2010"
"The social question, who cares? "," June 09, 2010"
Power units unable to fully utilise RIL gas ," June 09, 2010"
"L&T, Hindalco among six new SEZs "," June 08, 2010"
Anil withdraws defamation suit against Mukesh ," June 08, 2010"
Sensex sheds 337 points ," June 08, 2010"
Sensex sheds 337 points ," June 07, 2010"
Gulbarga low on investors' priorities? ," June 06, 2010"
"Sensex vaults 255 points to regain 17,000-level "," June 05, 2010"
"Offering range of ""intelligent"" stabilizers "," June 05, 2010"
"ONGC, OIL free to price natural gas at market rates "," June 04, 2010"
Sensex retraces 17000-mark ," June 04, 2010"
"ONGC, OIL free to price natural gas at market rates "," June 04, 2010"
"Govt. gives ONGC, OIL freedom to price natural gas "," June 03, 2010"
"Sensex regains 17,000 level as banking, refinery stocks rally "," June 03, 2010"
Sensex plunges over 626 as RIL gives rude jolt ," June 01, 2010"
Rs. 5-lakh cr.-worth investments coming Karnataka's way: Nirani ," June 01, 2010"
Rs. 5-lakh cr.-worth investments coming Karnataka's way: Nirani ," May 31, 2010"
Celluloid magic and tears ," May 31, 2010"
RIL’s stake in Iraq oil block reduces to 80 per cent ," May 31, 2010"
Different stock market perceptions ," May 31, 2010"
Different stock market perceptions ," May 31, 2010"
Different stock market perceptions ," May 30, 2010"
"8 of top-10 firms lose nearly Rs. 44,000 cr in M-Cap in a month "," May 30, 2010"
Celluloid magic and tears ," May 30, 2010"
Sensex rises in tandem with world markets ," May 29, 2010"
Sensex surges 197 points ," May 29, 2010"
RIL makes fifth oil discovery in Gujarat block ," May 28, 2010"
"Mukesh, Mittal hold meeting "," May 28, 2010"
Sensex up 197 points ," May 28, 2010"
Sensex surges by 278 points on heavy buying ," May 27, 2010"
"Speed up defence research, deliver on time: Manmohan to scientists "," May 26, 2010"
Sensex tumbles 447 points on concern over euro crisis ," May 26, 2010"
A new beginning? ," May 26, 2010"
A new beginning? ," May 25, 2010"
ONGC in talks with energy giants for tie-up for KG gas block ," May 25, 2010"
Sensex tumbles 447 points on concern over euro crisis ," May 25, 2010"
Mukesh Ambani caps salary at Rs. 15 cr; other RIL executives get hike ," May 25, 2010"
Profit-booking spoils Ambani truce party; Sensex ends flat ," May 24, 2010"
Sensex up 280 points on Ambani effect ," May 24, 2010"
Ambani brothers bury the hatchet ," May 24, 2010"
Engineering final year students of Cusat receive job offers ," May 23, 2010"
Ambani brothers bury the hatchet ," May 23, 2010"
Engineering final year students of Cusat receive job offers ," May 23, 2010"
Sensex stages partial recovery ," May 22, 2010"
"Gas price increased to help Reliance, says CPI(M) "," May 22, 2010"
Gas price increased to help Reliance: CPI(M) ," May 21, 2010"
The spectrum bonanza ," May 21, 2010"
The spectrum bonanza ," May 21, 2010"
In the grip of ‘Laila' fear ," May 21, 2010"
"Centre to meet on June 7 on freeing petrol, diesel prices "," May 20, 2010"
Telecom stocks in green after 3G auction ," May 20, 2010"
ONGC climbs 11% on natural gas price hike ," May 20, 2010"
"Sensex rebounds, up 165 points in opening trade "," May 20, 2010"
‘Laila' disrupts oil and gas production ," May 20, 2010"
Cabinet nod for hike in natural gas price ," May 20, 2010"
Cabinet nod for hike in natural gas price ," May 19, 2010"
Sensex gains on global cues ," May 19, 2010"
‘Take clearance for non-Kannada films' ," May 19, 2010"
Sensex closes 40 points up ," May 18, 2010"
"Market recovers early losses, Sensex up 108 points at mid-session "," May 18, 2010"
Non-financial services net profits likely to rise 22%: CMIE ," May 18, 2010"
Sensex opens 73 points lower on selective selling ," May 18, 2010"
Reliance joins hands with Russian co ," May 18, 2010"
Reliance joins hands with Russian co ," May 17, 2010"
Sensex sheds 159 pts ," May 17, 2010"
Sensex tanks on European debt concerns ," May 17, 2010"
"RIL, Russian firm sign MoU on butyl rubber production "," May 17, 2010"
RIL signs MoU with Russian company to produce butyl rubber ," May 16, 2010"
Crude prices may touch $100: Mukesh ," May 15, 2010"
Sensex plunges 271 points ," May 15, 2010"
Sensex plunges 271 points ," May 14, 2010"
Crude prices may touch $100: Mukesh ," May 14, 2010"
Sensex surges 191 points in opening trade ," May 13, 2010"
GSM operators oppose TRAI proposals ," May 13, 2010"
GSM operators oppose TRAI proposals ," May 12, 2010"
IOC to buy natural gas from RIL for replacing costlier fuel ," May 12, 2010"
Anil Ambani calls on Prime Minister ," May 12, 2010"
"Weak Asian, European markets drag Sensex "," May 12, 2010"
Sensex sheds 189 pts on profit booking ," May 11, 2010"
"RNRL down 5 p.c. as selling continues, RIL up 4.48 p.c. "," May 10, 2010"
"Sensex gains most in a day in 10 months, closes 561 points up "," May 10, 2010"
Sensex surges 430 points at mid-session on funds buying ," May 10, 2010"
Far-going judgment ," May 10, 2010"
Far-going judgment ," May 09, 2010"
"9 of top 10 companies lose Rs. 40k cr in m-cap, RIL lone gainer "," May 09, 2010"
Retail FDI may come with stiff conditions ," May 09, 2010"
Supreme Court order on RIL-RNRL gas row ," May 08, 2010"
"Centre's gas pricing policy will prevail, rules Supreme Court "," May 08, 2010"
Verdict can impact ADAG's power plans ," May 08, 2010"
"Ministry's stand vindicated, says Murli Deora "," May 08, 2010"
‘No plan for a review petition' ," May 08, 2010"
‘No plan for a review petition' ," May 08, 2010"
RIL ready to renegotiate gas price ," May 08, 2010"
Sensex tanks 218 points ," May 08, 2010"
RIL ready to renegotiate gas price ," May 07, 2010"
Verdict can impact ADAG's power plans ," May 07, 2010"
"Ministry's stand vindicated, says Murli Deora "," May 07, 2010"
Sensex tumbles to two-month low on European woes ," May 07, 2010"
‘No plan for a review petition' ," May 07, 2010"
"RIL gains 3 p.c., RNRL plunges 10 p.c. on SC verdict "," May 07, 2010"
"Centre's gas pricing policy will prevail, rules Supreme Court "," May 07, 2010"
"RIL down 2 pc, RNRL soars 5 pc ahead of gas dispute verdict "," May 07, 2010"
Sensex tumbles to two-month low on European woes ," May 07, 2010"
Apex court verdict in Reliance case on Friday ," May 07, 2010"
Sensex posts fresh losses ," May 07, 2010"
Apex court verdict in Reliance case today ," May 07, 2010"
"RIL, RNRL shares to remain in focus tomorrow: Analysts "," May 06, 2010"
"Sensex closes below 17,000 "," May 06, 2010"
Sensex recovers from early lows ," May 06, 2010"
Cinema ityadi ," May 06, 2010"
"RIL, RNRL gas dispute verdict expected on or before May 10 "," May 05, 2010"
Sensex tanks 268 pts on Greece debt concerns ," May 05, 2010"
Cinema ityadi ," May 05, 2010"
Govt. wants RIL to cut gas output to clear imported stocks ," May 04, 2010"
Mutual Fund industry assets grow 3 p.c. in April ," May 04, 2010"
Sensex falls 172 points as Greece debt woes continue to haunt ," May 03, 2010"
Power generation will be increased: Rosaiah ," May 03, 2010"
Alternative livelihood for tobacco workers suggested ," May 03, 2010"
Alternative livelihood for tobacco workers suggested ," May 02, 2010"
Sensex stages smart recovery ," April 30, 2010"
Karnataka gets 10 greenfield cement plants ," April 30, 2010"
RIL discovers oil in Cambay basin ," April 30, 2010"
Sensex bounces back ," April 29, 2010"
Reliance Industries makes fourth oil discovery ," April 29, 2010"
Balance-sheets of IPL franchises in order so far: Khurshid ," April 28, 2010"
Sensex tanks 310 points on Greece debt woes ," April 28, 2010"
Sensex tanks 229 points in early trade on weak global cues ," April 28, 2010"
Uptrend halted on BSE ," April 28, 2010"
Uptrend halted on BSE ," April 27, 2010"
Sensex advances 51 points ," April 27, 2010"
Meet the czar of the advertising world ," April 27, 2010"
Contest highlights importance of Indian culture ," April 26, 2010"
Five leading Indian firms under U.S. scanner for Iran links ," April 25, 2010"
Five leading Indian firms under U.S. scanner for Iran links ," April 25, 2010"
Sensex gains 120 points ," April 24, 2010"
"RIL profit crosses Rs. 16,000 crore "," April 24, 2010"
Putting precepts into practice ," April 24, 2010"
"RIL profit crosses Rs. 16,000 crore "," April 23, 2010"
"RIL Q4 profit up 30 per cent, full-year revenue crosses Rs 2 lakh crore "," April 23, 2010"
"Sensex gains 120 points, Nifty regains 5,300-mark "," April 23, 2010"
Putting precepts into practice ," April 23, 2010"
Sensex surges 119 points in opening trade ," April 23, 2010"
"Buying in RIL, SBI buoys Sensex "," April 23, 2010"
"I-T, ED officials question Modi "," April 22, 2010"
"SBI, RIL prop up the market "," April 22, 2010"
Profit booking trims gains in Sensex ," April 22, 2010"
Emerging Asian powers lead world growth with broad recovery ," April 21, 2010"
Sensex opens 95 points up on global cues ," April 21, 2010"
Reliance has 98.3% equity in Mumbai Indians ," April 21, 2010"
Volcano impact shows need for simplicity ," April 21, 2010"
Reliance has 98.3% equity in Mumbai Indians ," April 21, 2010"
"Sensex tumbles on Goldman, rate hike worries "," April 19, 2010"
Ways to prepare for overseas studies ," April 19, 2010"
Ways to prepare for overseas studies ," April 19, 2010"
I-T summons to BCCI for details on IPL transactions ," April 18, 2010"
"BRIC, IBSA nations not keen on Iran sanctions "," April 18, 2010"
I-T summons BCCI for details on IPL transactions ," April 17, 2010"
"CPCL to invest Rs. 10,000 crore on expansion "," April 17, 2010"
RIL to invest in Deccan 360 ," April 17, 2010"
In Bangalore Today ," April 17, 2010"
Sensex snaps gaining streak ," April 17, 2010"
RIL to invest in Deccan 360 ," April 17, 2010"
"CPCL to invest Rs. 10,000 crore on expansion "," April 17, 2010"
LNG terminal to be commissioned in 2012 ," April 16, 2010"
KG-gas price unviable: ONGC ," April 16, 2010"
LNG terminal to be commissioned in 2012 ," April 16, 2010"
KG-gas price unviable: ONGC ," April 16, 2010"
Sensex declines 180 points ," April 16, 2010"
Sensex plunges to two-week low ," April 15, 2010"
Sensex rises 153 points in early trade on global cues ," April 15, 2010"
S&P revises outlook on RIL to stable ," April 13, 2010"
Ways to prepare for overseas studies ," April 13, 2010"
Ways to prepare for overseas studies ," April 13, 2010"
IRDA asks insurance companies to ignore SEBI order ," April 11, 2010"
RIL to buy 40 % interest in Atlas Energy's Shale acreage ," April 10, 2010"
Telcos bid aggressively for 3G spectrum ," April 10, 2010"
Rising rupee will not hurt exports: Khullar ," April 10, 2010"
Rising rupee will not hurt exports: Khullar ," April 09, 2010"
RIL to buy 40 % interest in Atlas Energy's Shale acreage ," April 09, 2010"
RIL to invest $1.7 bn in ‘shale’ gas project in U.S. ," April 09, 2010"
RIL finds 4 more commercially viable gas reserves in KG basin ," April 09, 2010"
Telcos bid aggressively for 3G spectrum ," April 09, 2010"
Good old days when India built computers ," April 08, 2010"
Sensex tests 18000 after 2 years ," April 08, 2010"
Geithner calls for closer economic ties ," April 07, 2010"
"Sensex tests 18,000-mark; ends 29 points higher "," April 07, 2010"
Stocks close flat as profit booking kicks in ," April 06, 2010"
"Sensex tests 18,000-mark; ends 29 points higher "," April 07, 2010"
Stocks close flat as profit booking kicks in ," April 06, 2010"
Troop fatality figures show changing Maoist strategy ," April 05, 2010"
Troop fatality figures show changing Maoist strategy ," April 04, 2010"
