Headline,Posted
"Sensex bounces back from 7-month low, gains 265 pts "," February 11, 2011"
India should continue on reform path: Gary Locke ," February 11, 2011"
India should continue on reform path: Gary Locke ," February 10, 2011"
Anil Ambani seeks gas for power projects ," February 10, 2011"
Aero India 2011 off to a flying start ," February 10, 2011"
His long association with Sandalwood ," February 10, 2011"
His long association with Sandalwood ," February 09, 2011"
Anil Ambani seeks gas for power projects ," February 09, 2011"
Aero India 2011 off to a flying start ," February 09, 2011"
Timberland comes to Chennai ," February 09, 2011"
MLA for probe into K-G basin gas allotment ," February 09, 2011"
Antony for self-reliance in Defence technology ," February 08, 2011"
India should develop indigenous technological base: Antony ," February 07, 2011"
Baffling inflationary pressures ," February 07, 2011"
Vimal to reopen store ," February 07, 2011"
Airport Metro line all set to take off ," February 06, 2011"
Mobile number portability to intensify competition ," February 05, 2011"
GEMS-2K11 concludes ," February 05, 2011"
Over Rs.1.22 lakh crore lost in a day ," February 05, 2011"
Sensex crashes 441 points ," February 05, 2011"
Self-reliance in weapons vital: former Navy Chief ," February 05, 2011"
Over Rs.1.22 lakh crore lost in a day ," February 04, 2011"
"Sensex tumbles 441 points on inflation, interest rate concerns "," February 04, 2011"
Sensex down 291 points at mid-session ," February 04, 2011"
"India, Iran resolve crisis "," February 04, 2011"
Sensex gains further by 358 points ," February 04, 2011"
"India, Iran resolve crisis "," February 03, 2011"
"India, Iran resolve crisis "," February 03, 2011"
Education fair ," February 03, 2011"
Sensex snaps five-day falling streak; closes 68 points up ," February 02, 2011"
New investment in retail will widen career avenues ," February 02, 2011"
"Sensex tanks over 300 points, dips below 18k intra-day "," February 01, 2011"
Meet held on data communications ," February 01, 2011"
CII eco award for HZL ," February 01, 2011"
Use our donations for ‘Manimandapam' ," January 30, 2011"
Use our donations for ‘Manimandapam' ," January 30, 2011"
Sensex drops 289 points to 5-month low ," January 28, 2011"
Sensex drops 285 points ," January 28, 2011"
"Sensex falls 285 points on rising inflation, rate hike "," January 27, 2011"
KMA convention from February 3 ," January 26, 2011"
CISF to guard Airport Metro Line ," January 25, 2011"
Sensex dips below 19k on hike in RBI key rates ," January 25, 2011"
Sensex recovers on banks’ Q3 earnings; up 144 points ," January 24, 2011"
Experience main criteria for growth in retail sector ," January 24, 2011"
Sensex edges down ," January 22, 2011"
RIL net up 28 % ," January 22, 2011"
RIL Q3 net up 28.14 p.c. ," January 21, 2011"
“Explore newer areas to increase rubber production” ," January 20, 2011"
Sell-off in heavyweight counters ," January 20, 2011"
Unsavoury questions on corruption await Indian CEOs in Davos ," January 18, 2011"
The retail reformat ," January 17, 2011"
New pursuit for core disciplines ," January 17, 2011"
"Defence Production Policy release encouraging: CII, FICCI "," January 17, 2011"
New pursuit for core disciplines ," January 17, 2011"
Policy ready for self-reliance in defence ," January 14, 2011"
Policy ready for self-reliance in defence ," January 14, 2011"
Waning magic ," January 14, 2011"
Waning magic ," January 14, 2011"
‘Technology with human face needed' ," January 14, 2011"
A Vibrant Management Institution in Trichy ," January 14, 2011"
‘Technology with human face needed' ," January 13, 2011"
‘Technology with human face needed' ," January 13, 2011"
Gadkari to flag off BJP march on Sunday ," January 13, 2011"
CNG to be introduced by mid-April ," January 13, 2011"
Wide swings in Sensex ," January 12, 2011"
Normal power supply feasible ," January 12, 2011"
Sensex extends losses for 6th day in highly volatile trade ," January 11, 2011"
New pursuit for core disciplines ," January 11, 2011"
Adani strengthens fleet ," January 09, 2011"
Adani strengthens fleet ," January 08, 2011"
Panic selling drags down Sensex by 493 points ," January 08, 2011"
TiRUCHI today ," January 08, 2011"
Sensex tanks 364 points in mid-session ," January 07, 2011"
Guidelines on 3G video calls soon: Sibal ," January 05, 2011"
Sensex closes 197 points below ," January 05, 2011"
Sensex drops further by 120 points in early trade ," January 05, 2011"
Indigenisation in focus: Antony ," January 05, 2011"
Industrialists keen on investing in East Godavari ," January 05, 2011"
Sensex snaps 4-day rally on rate hike fears; slips 62 points ," January 04, 2011"
Yet another Defence Ministry project for State ," January 04, 2011"
Indian stock markets likely to remain buoyant in 2011 ," January 03, 2011"
Kerala's image yet to change: Karim ," January 03, 2011"
Specialised jobs need knowledge and experience ," January 03, 2011"
Indian stock markets likely to remain buoyant in 2011 ," January 02, 2011"
CM firm on taking ‘100-day agenda' throughout State ," January 02, 2011"
NIRDESH key to Navy's self-reliance ," January 02, 2011"
Television actors felicitated ," January 02, 2011"
Television actors felicitated ," January 02, 2011"
Television actors felicitated ," January 02, 2011"
Television actors felicitated ," January 02, 2011"
NIRDESH key to Navy's self-reliance ," January 02, 2011"
Sensex ends 2010 on optimistic note ," January 01, 2011"
"India, Iran to discuss oil payment crisis "," December 31, 2010"
A memorable year for Supreme Court ," December 31, 2010"
A memorable year for Supreme Court ," December 31, 2010"
"India, Iran to discuss oil payment crisis "," December 31, 2010"
The importance of Security Teaching in present scenario ," December 31, 2010"
Anil Ambani takes up power project issue with Kiran ," December 30, 2010"
Nod for private players to roll out 3G ," December 29, 2010"
Nod for private players to roll out 3G ," December 29, 2010"
Narrow movements on BSE ," December 29, 2010"
"Sensex stays flat in lacklustre trade at above 20,000 "," December 28, 2010"
Dasari felicitated for his contribution to television ," December 28, 2010"
Early gains not held on BSE ," December 28, 2010"
net asset values of open ended mutual fund schemes ," December 27, 2010"
Economy will undergo metamorphic change ," December 27, 2010"
Economy will undergo metamorphic change ," December 26, 2010"
“Niira Radia invested in the right people” ," December 25, 2010"
“Niira Radia invested in the right people ” ," December 25, 2010"
"Sensex up 97 pts at mid-session as RIL, Infosys stage comeback "," December 24, 2010"
Pact on piped gas inked ," December 24, 2010"
SNAPSHOTS ," December 24, 2010"
SNAPSHOTS ," December 24, 2010"
Security issues in video calls will be resolved soon: Sibal ," December 24, 2010"
Greater role for private sector in defence supplies underscored ," December 24, 2010"
Sensex ends lower by 33 points in range-bound trade ," December 23, 2010"
Security concerns on 3G video calls to be resolved soon: Sibal ," December 23, 2010"
Engagements ," December 23, 2010"
Sensex snaps gaining streak ," December 23, 2010"
‘Free power to ryots to continue for next 4 years' ," December 23, 2010"
Approach to SmartCity negative: Mullappally ," December 23, 2010"
Sensex cuts short 3-day rally; closes 45 points down ," December 22, 2010"
Sibal meets captains of top telecom firms ," December 22, 2010"
Sensex up 171 points on firm global cues ," December 22, 2010"
"RIL, Sibur of Russia to set up butyl rubber unit at Jamnagar "," December 22, 2010"
Pact on piped gas ," December 22, 2010"
"Sibal meets telcos heads, seeks views on sector "," December 21, 2010"
This day that age ," December 20, 2010"
‘Nourish values to accomplish success' ," December 20, 2010"
Medvedev in favour of “modernisation partnership” with India ," December 19, 2010"
Sensex surges 217 points on RBI decision to keep rates unchanged ," December 17, 2010"
Sensex surges 217 points on RBI decision to keep rates unchanged ," December 16, 2010"
50 trade pacts mark day one of Wen visit ," December 16, 2010"
50 trade pacts mark day one of Wen visit ," December 15, 2010"
Government approves 8 FDI proposals worth Rs. 883 crore ," December 14, 2010"
"Made in Guangzhou, sold in India "," December 14, 2010"
Sensex recovers 183 points on firm global cues ," December 14, 2010"
IRDA imposes Rs.50 lakh fine on 6 insurers ," December 13, 2010"
"Made in Guangzhou, sold in India "," December 13, 2010"
Sensex recovers 183 points on firm global cues ," December 13, 2010"
"For Radia, medium is the message, messenger "," December 13, 2010"
"In Radia tapes, an alarming picture of media manipulation "," December 13, 2010"
"For Radia, medium is the message, messenger "," December 13, 2010"
"In Radia tapes, an alarming picture of media manipulation "," December 12, 2010"
Reliance Digital to open more stores next year ," December 12, 2010"
Sensex snaps 3-day slide ," December 11, 2010"
Weekend break for Sensex; finishes with a gain of 266.53 points ," December 10, 2010"
AIFF signs deal with IMG Reliance ," December 10, 2010"
Meet to discuss development of gas infrastructure ," December 10, 2010"
Sensex loses 454 points ," December 10, 2010"
IOC tops Fortune India 500 ," December 10, 2010"
Wen to bring large trade delegation ," December 10, 2010"
IOC tops Fortune India 500 ," December 09, 2010"
Chinese Premier to bring large trade delegation ," December 09, 2010"
Sensex slips 47 points ," December 08, 2010"
Sensex slips 47 points in lacklustre trade ," December 07, 2010"
Profit-booking erases early gains ," December 07, 2010"
Vijjeswaram power plant work comes to a standstill ," December 07, 2010"
"Mukesh Ambani mulls PE venture with Rs 1,000 cr investment "," December 06, 2010"
Vijjeswaram power plant work comes to a standstill ," December 06, 2010"
"Sensex ends flat in volatile trade;weak financial, global cues "," December 06, 2010"
Vijjeswaram power plant work comes to a standstill ," December 06, 2010"
JNTU-K seeks Reliance support for research ," December 06, 2010"
"BFI-IMG Reliance pact, a boon for basketball "," December 05, 2010"
"BFI-IMG Reliance pact, a boon for basketball "," December 05, 2010"
"BFI-IMG Reliance pact, a boon for basketball "," December 05, 2010"
"BFI-IMG Reliance pact, a boon for basketball "," December 05, 2010"
"BFI-IMG Reliance pact, a boon for basketball "," December 05, 2010"
"BFI-IMG Reliance pact, a boon for basketball "," December 05, 2010"
Dow-Reliance venture was approved despite concerns ," December 04, 2010"
Dow-Reliance venture was approved despite concerns ," December 04, 2010"
Aim to achieve self-reliance for disabled: President ," December 03, 2010"
Sensex ends below 20K ," December 03, 2010"
Sensex breaches 20000-level ," December 03, 2010"
Waning phase for MGM magic ," December 03, 2010"
Sensex closes 143 points up ," December 02, 2010"
WikiLeaks holding U.S. power to account ," December 02, 2010"
The return of the Asians ," December 02, 2010"
The return of the Asians ," December 02, 2010"
RIL chooses LTE technology for BWA rollout ," December 02, 2010"
RIL chooses LTE technology for BWA rollout ," December 01, 2010"
Sensex on winning spree; climbs 329 points on global cues ," December 01, 2010"
Sensex gains 116 points as growth news helps erase losses ," November 30, 2010"
Sensex gains 116 points as growth news helps erase losses ," November 30, 2010"
Sensex rebounds with 268-point gain ," November 30, 2010"
Set up panel on pooled pricing of gas: Ministry ," November 30, 2010"
A peep through the ‘Windows to the future' ," November 29, 2010"
"Sensex rebounds after 4-day fall, up 268 points "," November 29, 2010"
Welcome to the Matrix of the Indian state ," November 29, 2010"
A peep through the ‘Windows to the future' ," November 29, 2010"
Welcome to the Matrix of the Indian state ," November 29, 2010"
RIL among world's largest chemical firms ," November 29, 2010"
Mukesh Ambani visits Tirumala ," November 27, 2010"
Housing loan scam continues to haunt BSE ," November 27, 2010"
India crude oil production nearly 14 p.c. in October ," November 26, 2010"
Saudi Arabia set to become industrial power: academic ," November 26, 2010"
Reliance staff gesture ," November 26, 2010"
Waning phase for MGM magic ," November 26, 2010"
Waning phase for MGM magic ," November 26, 2010"
Sensex erases early gains; lose 141 points ," November 25, 2010"
Midhani to complete orders by December-end ," November 25, 2010"
Government accords priority for welfare of minority community ," November 25, 2010"
'Saudi Arabia set to become industrial power' ," November 24, 2010"
Hypocrisy of the ‘free market' apostles ," November 24, 2010"
Sensex ends 265 points down after early 615-point slide ," November 23, 2010"
Sensex stages strong recovery ," November 23, 2010"
Sensex surge highest in two weeks ," November 22, 2010"
Sensex tanks sheds 345 points on spectrum row ," November 19, 2010"
APGIC proposes to lay mini-gas trunk line ," November 19, 2010"
APGIC proposes mini gas trunk lines ," November 18, 2010"
Sensex ends higher by 65 points in volatile trade ," November 18, 2010"
Meet to prepare for Manmohan-Medvedev summit ," November 18, 2010"
Meeting to prepare for Manmohan-Medvedev summit ," November 18, 2010"
Mukesh Ambani bags Global Vision Award ," November 18, 2010"
Augment exports to Latin America: Scindia ," November 18, 2010"
Mukesh Ambani bags Global Vision Award ," November 17, 2010"
Augment exports to Latin America: Scindia ," November 17, 2010"
Stock markets crumble on global economic woes ," November 17, 2010"
‘We have not given clean chit to anyone' ," November 17, 2010"
Stock markets crumble on global economic woes ," November 17, 2010"
“Report does not single out Raja” ," November 16, 2010"
CRESCITA to shine from November 19 ," November 16, 2010"
Stock markets crumble on global economic woes ," November 16, 2010"
Seminar on indigenisation begins ," November 16, 2010"
Major firms recruit interns from IIM-K ," November 16, 2010"
Major firms recruit interns from IIM-K ," November 15, 2010"
Easing inflation helps Sensex close by 153 points up ," November 15, 2010"
CRESCITA to shine from November 19 ," November 15, 2010"
Sensex tanks 432 points ," November 13, 2010"
Mukesh Ambani to get Eisenhower global leadership award ," November 12, 2010"
"Sensex tumbles on weak factory output data, global cues "," November 12, 2010"
Abdul Kalam lays stress on professional skills in syllabus ," November 12, 2010"
India Economic Summit to focus on infrastructure ," November 12, 2010"
Oilex strikes gas in Cambay Basin ," November 12, 2010"
Oilex strikes gas in Cambay Basin ," November 12, 2010"
"Impart professional skills, says Kalam "," November 12, 2010"
India Economic Summit to focus on infrastructure ," November 12, 2010"
Oilex strikes big gas reserves south of Ahmedabad ," November 11, 2010"
Sensex closed down by 57 points ," November 10, 2010"
"Sensex rebounds with 80-point gain; HDFC Bank, ICICI Bank lead "," November 09, 2010"
U.S. to help in shale gas technology ," November 09, 2010"
U.S. to help in shale gas technology ," November 09, 2010"
Gas for Karimnagar project on EGoM agenda ," November 09, 2010"
Life is looking up for them ," November 09, 2010"
"Coal blocks issued to ArcelorMittal, Tata and 17 others "," November 08, 2010"
"India, US sign deal for promotion of clean energy "," November 08, 2010"
Sensex falls from record levels on profit-booking; down 152 pts ," November 08, 2010"
Indian deals will create 7 lakh jobs in U.S.: CII ," November 08, 2010"
GoM to decide on change in gas allocation policy ," November 08, 2010"
Indian deals will create 7 lakh jobs in U.S.: CII ," November 08, 2010"
Rosaiah writes to Deora on gas ," November 08, 2010"
GoM to decide on change in gas allocation policy ," November 08, 2010"
China to reduce reliance on mineral imports ," November 08, 2010"
China to boost exploration efforts as mineral demand grows ," November 07, 2010"
CIL short of Rs. 731 crore to become India’s 3rd most valued firm ," November 07, 2010"
CIL short of Rs. 731 crore to become India’s 3rd most valued firm ," November 07, 2010"
India signs $10-billion worth deals with U.S. ," November 07, 2010"
Keltron signs MoU with Russian firm ," November 07, 2010"
"Sonia, Tata in Forbes' list of 68 people “who matter” "," November 05, 2010"
Samvat 2066 ends on buoyant note ," November 05, 2010"
Samvat 2066 ends on buoyant note ," November 04, 2010"
"Sonia Gandhi, Tata in Forbes’ most powerful people list "," November 04, 2010"
Hu Jintao pips Obama to become most powerful person: Forbes ," November 04, 2010"
Marginal drop in Sensex ," November 03, 2010"
BG Group to invest $500 m in next five years ," November 03, 2010"
ONGC plans $10-b investment in new gas discoveries ," November 03, 2010"
BG Group to invest $500 min next five years ," November 02, 2010"
Draft norms on new bank licences by January: RBI ," November 02, 2010"
ONGC plans $10-b investment in new gas discoveries ," November 02, 2010"
Sensex ends down a bit after RBI's rate hike ," November 02, 2010"
India rich in missile wealth: says Pallam Raju ," November 02, 2010"
‘Offset Policy' to spur indigenisation: Minister ," November 02, 2010"
Sensex forges ahead on firm global cues ," November 02, 2010"
"RIL scrip up 2.6%, at month peak of Rs 1,125 "," November 01, 2010"
Sensex forges ahead on firm global cues ," November 01, 2010"
‘Future for science and technology lies in multi-disciplinary approach' ," November 01, 2010"
"RIL net up 28 % at Rs.4,923 cr "," October 31, 2010"
Seminar held ," October 31, 2010"
"RIL net up 28 % at Rs.4,923 cr "," October 30, 2010"
Opportunities galore for MSMEs to supply to defence ," October 30, 2010"
"Sensex snaps three-day fall, ends 91 points up "," October 29, 2010"
RPower awards $8.2-b order to Shanghai Electric ," October 29, 2010"
RPower awards $8.2-b order to Shanghai Electric ," October 29, 2010"
JCB India enters shoe business ," October 29, 2010"
Bringing different genres of Indian music to limelight ," October 29, 2010"
Indian firm buying English football team ," October 29, 2010"
Indian firm to buy English football team ," October 29, 2010"
JCB enters shoe business ," October 28, 2010"
Cairn India profit trebles in July-September quarter ," October 28, 2010"
"Sensex ends below crucial 20k level, fall for third day "," October 28, 2010"
Shale gas agreement likely during Obama visit ," October 28, 2010"
Sensex drops for second day ," October 28, 2010"
Sensex tumbles to a week low ahead of derivatives expiry ," October 27, 2010"
"Sensex flip-flops in volatile trade, closes 81 points down "," October 26, 2010"
Sensex gains 137 points on healthy quarterly results ," October 25, 2010"
Manmohan invites Japanese firms to invest in infrastructure projects ," October 25, 2010"
Reliance re-opens petroleum outlets ," October 24, 2010"
Sensex declines 95 points in volatile trade ," October 22, 2010"
Sensex regains 20000-mark ," October 22, 2010"
"Sensex vaults 388 points to regain 20,000 level "," October 21, 2010"
HDFC Bank Q2 net up 33 % ," October 20, 2010"
"Sensex sheds 186 pts to end below 20,000 level "," October 19, 2010"
Desertion of parties not to hit LDF: MP ," October 19, 2010"
Court dispenses with accused's personal appearance ," October 19, 2010"
Desertion of parties not to hit LDF: MP ," October 19, 2010"
Court dispenses with accused's personal appearance ," October 18, 2010"
Smart recovery in Sensex ," October 18, 2010"
For that swadeshi flavour ," October 18, 2010"
"8 top firms lose Rs. 29,000 crore in m-cap "," October 17, 2010"
Growth of the cement industry ," October 16, 2010"
RIL raises $1.5 b ," October 16, 2010"
Sensex plunges 373 pts as investors mop up funds for mega IPO ," October 15, 2010"
Sensex sheds 190 points ," October 15, 2010"
Sensex slumps by 190 points ," October 14, 2010"
Sensex sheds 137 points ," October 13, 2010"
Sensex gains 90 points at 20340 ," October 12, 2010"
RIL rises 2 p.c. to hit month high ," October 11, 2010"
Sensex gains 90 points on earnings expectations ," October 11, 2010"
BARL to take up rail link project ," October 11, 2010"
RIL wrong in seeking out-of-turn hike in price: Oil Ministry ," October 10, 2010"
Delhi HC rejects RIL plea to quash CBI case against it ," October 10, 2010"
Sensex snaps 5-week gains on profit-booking ," October 09, 2010"
34 blocks on offer under NELP-IX ," October 09, 2010"
Sensex declines in flip-flop trading ," October 08, 2010"
Profit booking drags Sensex by 228 points ," October 08, 2010"
Fast Breeder Test Reactor to turn 25 ," October 07, 2010"
Fast Breeder Test Reactor to turn 25 ," October 07, 2010"
Fast Breeder Test Reactor to turn 25 ," October 07, 2010"
SPV for high-speed rail link ," October 06, 2010"
Reliance gesture to chess player ," October 05, 2010"
Early gains not fully held on BSE ," October 05, 2010"
Sensex at 33-month high on buying by funds ," October 04, 2010"
7 of top 10 firms add Rs. 29k cr to m-cap last week ," October 03, 2010"
Khadi and Gandhiji: looking beyond the fabric ," October 03, 2010"
Khadi and Gandhiji: looking beyond the fabric ," October 03, 2010"
Sensex kicks off October with a bang; surges 376 pts ," October 01, 2010"
TIRUCHI TODAY ," October 01, 2010"
Mukesh tops Forbes ‘India Rich’ List ," September 30, 2010"
"Sensex up 113 points, regains 20,000 level "," September 30, 2010"
Sensex dips below 20000-mark ," September 30, 2010"
Bangalore: the success story of ICT industry ," September 28, 2010"
Sensex loses steam as investors book profit ," September 28, 2010"
Kuwait evinces interest in acquiring stake in Indian Oil Corporation ," September 28, 2010"
Sensex gains 72 points ," September 28, 2010"
Bangalore: the success story of ICT industry ," September 28, 2010"
Engagements ," September 28, 2010"
Sensex climbs for second day to fresh 32-month high ," September 27, 2010"
Army conducts recruitment drive ," September 27, 2010"
Criminal proceedings against Balaji Fertilizers stayed ," September 25, 2010"
"EIH to raise Rs.1,300-cr through rights issue "," September 25, 2010"
"EIH to raise Rs.1,300-cr through rights issue "," September 24, 2010"
‘India should engage in aggressive oil diplomacy' ," September 24, 2010"
Sensex loses further ground ," September 24, 2010"
‘India should engage in aggressive oil diplomacy' ," September 23, 2010"
Profit-taking in equities ," September 23, 2010"
Access to energy seen as vital to fighting worst poverty ," September 23, 2010"
Seminar on ‘Plastics for Green Buildings' ," September 23, 2010"
Access to energy seen as vital to fighting worst poverty ," September 22, 2010"
Profit-taking in equities ," September 22, 2010"
BSE-NSEBSE index ," September 22, 2010"
Sensex hits 20000-mark ," September 22, 2010"
Sensex soars 311 points ," September 21, 2010"
Bangalore today ," September 21, 2010"
Sensex soars 311 points ," September 21, 2010"
Sensex soars 311 points ," September 20, 2010"
Labour disputes on the rise in China ," September 19, 2010"
Awards presented at HR meet ," September 19, 2010"
Labour disputes on the rise in China ," September 18, 2010"
Sensex surges 795 points on strong economic outlook ," September 18, 2010"
Sensex bounces back by 177 points to fresh 32-month high ," September 17, 2010"
Sensex snaps seven-day rally ," September 17, 2010"
TIRUCHi today ," September 17, 2010"
Markets snaps 7-day rally; Sensex down 85 points ," September 16, 2010"
“Introduce paid content models in digital media” ," September 16, 2010"
“Introduce paid content models in digital media” ," September 16, 2010"
Sensex up 155 points ," September 16, 2010"
Markets up for the 7th day in a row; Sensex gains 155 pts ," September 15, 2010"
"ICE: integrating branches, creating avenues "," September 14, 2010"
A new power plant for Capital ," September 14, 2010"
Delhi to get new gas-based power plant ," September 13, 2010"
RIL completes deal to buy 60% stake in U.S. firm ," September 13, 2010"
"ICE: integrating branches, creating avenues "," September 13, 2010"
RIL completes deal to buy 60% stake in U.S. firm ," September 12, 2010"
"Sensex up 85 points on rally in RIL, cement shares "," September 08, 2010"
17 million mobile users added in July: TRAI ," September 07, 2010"
CAG sends RIL gas field audit report to Petroleum Ministry ," September 07, 2010"
"Sensex up 85 points on rally in RIL, cement shares "," September 07, 2010"
Sethna - the man who dared to dream ," September 07, 2010"
Oilex claims huge gas finds in Gujarat ," September 07, 2010"
Sethna - the man who dared to dream ," September 07, 2010"
Sensex rallies to 30-month high ," September 07, 2010"
Award for Navabharat sugars division ," September 07, 2010"
Oilex claims huge gas finds in Gujarat ," September 06, 2010"
RNRL-Reliance Power merger gets shareholders’ nod ," September 06, 2010"
Sensex rallies to 30-month high ," September 06, 2010"
"BHEL, IITM synergise research initiatives "," September 06, 2010"
"Reliance on computers very high, says Annadurai "," September 04, 2010"
"Reliance on computers very high, says Annadurai "," September 04, 2010"
Sensex reverses uptrend ," September 04, 2010"
Ray of hope ," September 03, 2010"
State seeks gas allocation for urea plant ," September 03, 2010"
"Centre to select new chiefs for ONGC, BPCL and IOC "," September 03, 2010"
Profit booking pares initial gains ," September 03, 2010"
