Headline,Posted
Gas production: RIL completes one year ," April 03, 2010"
Filmmakers should come out of comfort zones: Hrithik Roshan ," April 02, 2010"
The Hindu Crossword 9806 ," April 02, 2010"
Sensex up 165 points ," April 02, 2010"
Course certificates distributed ," April 02, 2010"
BHELSIA acknowledges urgent need for capacity expansion ," April 01, 2010"
Sensex closes up 165 pts; IT stocks in limelight ," April 01, 2010"
Sensex extends 80 % return in 2009-10 ," April 01, 2010"
Sensex falls 62 points on year-end selling ," March 31, 2010"
IIM-B PG course fee to be Rs. 13 lakh ," March 31, 2010"
Indian space programme moving to new capabilities: ISRO Chief ," March 30, 2010"
Sensex up 71 points in early trade on global cues ," March 30, 2010"
IIM-B hikes PG course fee to Rs. 13 lakh ," March 30, 2010"
"Investment proposals amounting to Rs. 94,000 crore cleared "," March 30, 2010"
IIM-B raises PG course fee to Rs. 13 lakh ," March 30, 2010"
Sensex up 80 points in opening trade on Asian cues ," March 29, 2010"
‘Make gas prices uniform sectorally’ ," March 28, 2010"
Seventh straight week of gains for Sensex ," March 27, 2010"
‘SHGs ensure liberty for women' ," March 27, 2010"
Sensex posts modest gains ," March 27, 2010"
Sensex falls over 61 points on global cues ," March 25, 2010"
Digital impact on media and entertainment ," March 24, 2010"
Sensex edges up 40 points ," March 24, 2010"
Sensex rises by 120 points in opening trade ," March 23, 2010"
"ONGC, OIL may get higher price for gas "," March 23, 2010"
Qatar to supply 4 mt of LNG from 2013 ," March 23, 2010"
"Sensex yields ground, loses 168 points "," March 23, 2010"
"ONGC, OIL may get higher price for gas "," March 22, 2010"
"India to add 7,450 km to gas pipeline network in 3 years "," March 22, 2010"
Qatar ready to sell gas at higher price ," March 22, 2010"
Sensex falls over 240 points as RBI raises key rates ," March 22, 2010"
KG basin gas to flow from 2012 ," March 21, 2010"
Sensex falls over 240 points as RBI raises key rates ," March 22, 2010"
KG basin gas to flow from 2012 ," March 21, 2010"
KG basin gas to flow from 2012 ," March 21, 2010"
Sensex gains 59 points ," March 20, 2010"
Quality award ," March 20, 2010"
"Sensex gains for fourth day, up by 59 points "," March 19, 2010"
Power shortage will ease soon: Chief Secretary ," March 19, 2010"
Coimbatore Today ," March 19, 2010"
Power shortage will ease soon: Chief Secretary ," March 19, 2010"
"‘Public, private sector to have bigger role in equipment production' "," March 18, 2010"
"‘Public, private sectors to have bigger role in equipment production' "," March 18, 2010"
RCom ties up with Polycom for video conferencing service ," March 18, 2010"
APIIC acquiring land for Wood City ," March 18, 2010"
RCom ties up with Polycom for video conferencing service ," March 17, 2010"
Sensex surges 118 points in opening trade ," March 17, 2010"
Sensex surges to two-month high ," March 17, 2010"
Reliance in talks with U.S. energy firm for joint venture ," March 17, 2010"
Reliance in talks with U.S. energy firm for joint venture ," March 16, 2010"
Sensex soars 218 points to close at eight-week high ," March 16, 2010"
Tariff war to intensify in months ahead: RCom ," March 16, 2010"
RCom to strengthen presence in India: Mahesh Prasad ," March 16, 2010"
Sensex rises by 48 points in opening trade on global cues ," March 16, 2010"
"Reliance, IMG form sports venture "," March 16, 2010"
"RIL, MRPL to buy OVL's Venezuelan oil "," March 16, 2010"
"RIL, MRPL to buy OVL's Venezuelan oil "," March 15, 2010"
Brown wades into BA industrial dispute ," March 15, 2010"
Sensex back in green at mid-session ," March 15, 2010"
Carlos Slim richest person in the world ," March 12, 2010"
Sensex ends higher by 70 points ," March 12, 2010"
Sensex ends higher by 70 pts; RIL gains 0.84 pc ," March 11, 2010"
Sensex gains 70 points in volatile trade ," March 11, 2010"
Carlos Slim richest person in the world ," March 11, 2010"
The see-saw of Sez ," March 11, 2010"
Bangalore today ," March 11, 2010"
IT firms face peak hour power cuts ," March 11, 2010"
Markets in consolidation mode ," March 11, 2010"
Markets in consolidation mode ," March 11, 2010"
IT firms face peak hour power cuts ," March 11, 2010"
Sensex rises by 46 pts to seven-week high ," March 10, 2010"
Government to rationalise natural gas prices ," March 10, 2010"
Reliance gas for Konaseesma project ," March 10, 2010"
Sensex declines by 50 points ," March 10, 2010"
"Sanctions on Iran counter-productive, says India "," March 10, 2010"
"Sanctions on Iran counterproductive, says India "," March 09, 2010"
Sensex declines by 50 points ," March 09, 2010"
Blue-chip counters to the fore ," March 09, 2010"
‘Shipping industry needs skilled professionals' ," March 09, 2010"
Blue-chip counters to the fore ," March 08, 2010"
"Sensex regains 17,000-mark on auto, bank rally "," March 08, 2010"
‘City needs separate power station to tide over demand' ," March 08, 2010"
Operators oppose TRAI move to charge new number allocation ," March 07, 2010"
"Budget buzz dominates bourses; Sensex hits 17K, gains 565 pts "," March 06, 2010"
Sensex closes flat at 16994 ," March 06, 2010"
SEBI to further probe insider trading charges in RPL shares ," March 05, 2010"
"Sensex up 124 points, Nifty regains 5,100-level in opening trade "," March 05, 2010"
Sensex drops by 28 points on inflation concerns ," March 04, 2010"
Sensex retraces 17000-mark ," March 04, 2010"
"Budget, Reliance take Sensex to 17,000 mark "," March 03, 2010"
Sensex up 120 points as post-budget rally continues ," March 03, 2010"
Sensex surges 243 points in opening trade on global cues ," March 02, 2010"
Sand sculpture enthrals visitors at school fete ," February 28, 2010"
Banking foray: industrial houses' dream realised ," February 27, 2010"
Pranab juggles duties on petroleum products ," February 27, 2010"
Banking foray: industrial houses' dream realised ," February 26, 2010"
INTACH workshop ," February 26, 2010"
"Discard old mindsets, Antony tells DRDO "," February 24, 2010"
"Discard old mindsets, Antony tells DRDO "," February 24, 2010"
President Pratibha Patil’s address to Parliament ," February 22, 2010"
Software testing market calling ," February 22, 2010"
Kochi today ," February 21, 2010"
Sensex down 173 points in opening trade on Asian cues ," February 19, 2010"
Reliance drags Sensex down ," February 18, 2010"
Sensex posts further gains on FII buying ," February 18, 2010"
‘India will be jewellery hub by 2012’ ," February 17, 2010"
Sensex surges 188 points ," February 17, 2010"
Cooperative sector key to rural development: VS ," February 15, 2010"
Mukesh donates Rs.5 crore to TTD ," February 13, 2010"
Oil regulator asks RIL to club gas margin with sale price ," February 12, 2010"
120 kg gold received so for: TTD chairman ," February 12, 2010"
Sensex gains 174 points in opening trade on Asian cues ," February 11, 2010"
Budget may have special features for industries ," February 11, 2010"
Mukesh donates Rs.5 crore to TTD ," February 11, 2010"
Iran says it continues to import fuel from RIL ," February 09, 2010"
"Implement Parikh Committee report, says CARE "," February 06, 2010"
Cyberwar is ‘rapidly growing threat’ ," February 05, 2010"
Cyberwar is ‘rapidly growing threat’ ," February 05, 2010"
Oil stocks surges up to 4pc on BSE ," February 04, 2010"
"Sensex slips 271 points led by realty, metals "," February 04, 2010"
"More Tejas, Akash for IAF: Antony "," February 03, 2010"
IAF to procure more Tejas aircraft and Akash missiles: Antony ," February 02, 2010"
Markets crash on profit booking ," February 02, 2010"
Sensex opens lower ," February 01, 2010"
Commendation certificate given to RIL ," January 31, 2010"
Thackeray slams Mukesh Ambani ," January 29, 2010"
India-focused M&A deals value touches USD 3 bn since 2010 ," January 28, 2010"
Sensex gains 203 points in opening trade on global cues ," January 28, 2010"
Mumbai belongs to all of India: Mukesh Ambani ," January 28, 2010"
Davos debates financial reform vs over-regulation ," January 28, 2010"
Mumbai belongs to all of India: Mukesh Ambani ," January 28, 2010"
World’s rocky economic recovery tops Davos debate ," January 27, 2010"
"Tata, Ambanis in FTs’ list "," January 27, 2010"
Leaders from 90 nations to discuss global challenges ," January 26, 2010"
"Tata, Ambanis in FT’s 50 emerging market business leaders list "," January 26, 2010"
Sensex down 115 points in opening trade on global cues ," January 25, 2010"
Training programme held ," January 25, 2010"
Seven of top-10 cos lose Rs. 73k cr in m-cap ," January 24, 2010"
Marginal drop in RIL net in April-December 2009 ," January 23, 2010"
Sensex closes 191 pts down ," January 22, 2010"
"Sensex falls on rising food prices, Nifty break 5,200 level "," January 21, 2010"
Sensex down 104 points in early trade ," January 21, 2010"
"Sensex ends flat; ONGC, Wipro among losers "," January 20, 2010"
Sensex erases early gains as refiners fall ," January 20, 2010"
Sensex up over 104 points in opening trade ," January 20, 2010"
Profit-booking shaves off 155 pts from Sensex ," January 19, 2010"
Profit selling pulls market down at mid-session ," January 19, 2010"
Sensex up 23 points in opening trade ," January 19, 2010"
Industry-specific courses to boost employability ," January 19, 2010"
High speed interceptor boat for Kakinada port ," January 19, 2010"
‘Media must play a responsible role' ," January 18, 2010"
EIL’s follow-on offer to hit market in July ," January 17, 2010"
‘Media must play a responsible role' ," January 18, 2010"
EIL’s follow-on offer to hit market in July ," January 17, 2010"
Anil Ambani eyes MGM ," January 16, 2010"
Sensex down 31 points ," January 15, 2010"
TRS opposes move to scale down power plant capacity ," January 14, 2010"
Euro-III grade fuel sale to be delayed ," January 13, 2010"
Stress on media’s social responsibility ," January 13, 2010"
Stress on media’s social responsibility ," January 13, 2010"
Reliance Footprint’s plans ," January 13, 2010"
TDP leader decries Kavita remarks ," January 13, 2010"
Home for senior citizens ready for inauguration ," January 13, 2010"
Cairn India to commission 300 km barmer pipeline soon ," January 12, 2010"
Stocks slide for fourth day ," January 12, 2010"
Sensex up 67 points in opening trade ," January 12, 2010"
"RIL raises Rs. 3,465 cr from treasury stocks "," January 12, 2010"
Initial gains not held on BSE ," January 12, 2010"
RIL readies LyondellBasell bid; raises $2 bn ," January 11, 2010"
Markets close flat; RIL down by close to 2 per cent ," January 11, 2010"
NSUI leader held ," January 11, 2010"
Life insurers add 13 lakh agents during 2008-09 ," January 10, 2010"
Award for leadership ," January 10, 2010"
‘Attacks on Reliance pre-meditated’ ," January 10, 2010"
Important Correction ," January 09, 2010"
Two editors of TV 5 arrested in Hyderabad ," January 09, 2010"
Sensex declines on rupee worries ," January 09, 2010"
Naidu seeks CBI probe into attack on Reliance stores ," January 09, 2010"
Armed vigil at on-shore terminal ," January 09, 2010"
Bid to unseat Rosaiah: Naidu ," January 09, 2010"
Rumours on YSR’s death lead to violence ," January 09, 2010"
Two TV5 editors held ," January 09, 2010"
RIL sweetens bid for Lyondell ," January 09, 2010"
"Rupee spooks markets again, Sensex sheds 75 pts "," January 08, 2010"
Ambanis deny allegations; Rosaiah asks Centre to expedite probe ," January 08, 2010"
Reliance expresses outrage over ‘motivated news’ ," January 08, 2010"
Reliance outlets attacked in A.P. ," January 08, 2010"
Turning a new reel ," January 08, 2010"
Reliance installations attacked in Andhra Pradesh ," January 08, 2010"
"RIL’s CSR activities tackle water, transport problem "," January 08, 2010"
"Markets snap 4-day rally on rupee worries, Sensex falls 85 pts "," January 07, 2010"
Sensex gains 104 points in opening trade on firm Asian cues ," January 06, 2010"
Diamonds are forever ," January 06, 2010"
Panel gives go-ahead for 38 mega projects ," January 06, 2010"
Sensex ends at 23-month high ," January 05, 2010"
Petrobras to exit ONGC’s KG block ," January 05, 2010"
Petrobras to exit ONGC’s KG block ," January 05, 2010"
"RIL sells treasury stocks for Rs. 2,675 cr "," January 05, 2010"
"Reliance Industries raises Rs.2,675 cr from share sale "," January 04, 2010"
Markets start 2010 on firm note; sensex up 94 points ," January 04, 2010"
"Reliance Industries raises Rs.2,675 cr from share sale "," January 04, 2010"
Markets start 2010 on firm note; sensex up 94 points ," January 04, 2010"
"Private Equity, Venture Capital investments set to be robust in ‘10: Experts "," January 03, 2010"
"Petrobras to exit ONGC block, Shell keen to get in "," January 03, 2010"
Expert moots extensive use of plasma gasification ," January 03, 2010"
The gap widens ," January 03, 2010"
Corporates weather economic downturn with vigour ," January 02, 2010"
Students told to aim high ," January 02, 2010"
Corporates weather economic downturn with vigour ," January 01, 2010"
A controversial year for oil and gas sector ," January 01, 2010"
"Right to water, compensation to riot victims and more "," January 01, 2010"
A controversial year for oil and gas sector ," January 01, 2010"
Sensex enters Silver Jubilee year ," January 01, 2010"
New year full of promise for markets ," January 01, 2010"
Turning a new reel ," January 01, 2010"
New year full of promise for markets ," December 31, 2009"
Sensex enters Silver Jubilee year ," December 31, 2009"
Reliance Retail to open 45 books & music stores by Dec 2014 ," December 31, 2009"
"Right to water, compensation to riot victims and more "," December 31, 2009"
RIL Executive Director Ravi Mohan passes away ," December 30, 2009"
RIL carries out KG D6’s design capacity ," December 30, 2009"
RIL Executive Director Ravi Mohan passes away ," December 29, 2009"
Call for concrete steps to raise trade with Japan ," December 29, 2009"
West Bengal gives major boost to solar energy ," December 29, 2009"
Call for concrete steps to raise trade with Japan ," December 28, 2009"
China enacts law to promote renewable energy ," December 27, 2009"
"Top 10 companies add Rs 70,000 cr last week "," December 27, 2009"
Protsaham to encourage poor students: Collector ," December 27, 2009"
11 SEZs refused in-principle nod ," December 26, 2009"
11 SEZs refused in-principle nod ," December 25, 2009"
Bommuluru abuzz with creative activity ," December 25, 2009"
Fertilizer industry seeks sops from government ," December 25, 2009"
Sensex gains 116 points in opening trade ," December 24, 2009"
Manmohan may discuss freeing auto fuel prices on Jan. 13 ," December 23, 2009"
Sensex rises over 150 points in opening trade on global cues ," December 23, 2009"
Domestic gas supply from June: Rosaiah ," December 23, 2009"
Sensex rises over 150 points in opening trade on global cues ," December 23, 2009"
ONGC Videsh to bid for Venezuela’s oil blocks ," December 23, 2009"
RIL strikes more gas in KG basin ," December 23, 2009"
Domestic gas supply from June: Rosaiah ," December 23, 2009"
RIL strikes more gas in KG basin ," December 22, 2009"
ONGC Videsh to bid for Venezuela’s oil blocks ," December 22, 2009"
Give tax holiday to new fertiliser plants: Assocham ," December 22, 2009"
Govt. to take SEBI on RIL share issue seriously: Khurshid ," December 22, 2009"
"Profit booking grips markets, Sensex sheds 118 points "," December 21, 2009"
Sensex gains 31 points in opening trade ," December 21, 2009"
Job programme benefits youth ," December 19, 2009"
Apex court reserves verdict in Reliance gas dispute case ," December 19, 2009"
Sensex drops on rate hike fears ," December 19, 2009"
Apex court reserves verdict in Reliance gas dispute case ," December 18, 2009"
Shell rules out more capital investment in India ," December 18, 2009"
Mukesh Ambani ranked fifth best CEO in the world ," December 18, 2009"
Markets extend loss as FIIs book profits ," December 18, 2009"
"No legal rights would flow to RNRL from MoU, asserts RIL "," December 18, 2009"
"No legal rights would flow to RNRL from MoU, asserts RIL "," December 17, 2009"
Government approval mandatory in gas pricing: Salve ," December 17, 2009"
U.S. bill on gasoline curbs irrelevant: Iran ," December 17, 2009"
Government approval mandatory in gas pricing: Salve ," December 17, 2009"
U.S. bill on gasoline curbs irrelevant: Iran ," December 16, 2009"
Sensex down 67 points in early trade on global cues ," December 16, 2009"
CAG to begin audit of RIL accounts ," December 16, 2009"
CAG to begin audit of RIL accounts ," December 16, 2009"
Move for separate State may affect industrial development ," December 16, 2009"
Sensex sheds 220 points ," December 16, 2009"
Fundamentals kept uncertain in gas contract ," December 16, 2009"
Fundamentals kept uncertain in gas contract ," December 15, 2009"
Sensex up 103 points in early trade ," December 15, 2009"
Tiruchi today ," December 15, 2009"
"Reliance Big in alliance with T-Series, Hungama "," December 13, 2009"
RCom bags state govt projects ," December 13, 2009"
RCom bags state govt projects ," December 13, 2009"
TCS tops Asian Sustainability Ratings for 2009 ," December 11, 2009"
Sensex rises by 158 points in opening trade on global cues ," December 11, 2009"
"Lyondell, Hyundai Engg ink pact "," December 11, 2009"
Chief Minister seeks Prime Minister’s intervention ," December 11, 2009"
Ravva proves a low-cost field for Cairn ," December 10, 2009"
Metro Rail extends last date for RFQ applications ," December 10, 2009"
Eiffel tower replica in Yanam ," December 10, 2009"
"Sensex down 102 points while metal, banking shares under pressure "," December 09, 2009"
No final bid yet from RIL: LyondellBasell ," December 09, 2009"
Sensex declines by 117 pts in early trade ," December 09, 2009"
India likely to access vast resources in eastern Siberia and far eastern Russia ," December 09, 2009"
‘No loss to govt if gas is sold at $2.34’ ," December 09, 2009"
Drilling rig moratorium likely soon ," December 09, 2009"
‘No loss to govt if gas is sold at $2.34’ ," December 09, 2009"
India likely to access vast resources in eastern Siberia and far eastern Russia ," December 09, 2009"
Drilling rig moratorium likely soon ," December 09, 2009"
"Learning to change, for survival "," December 08, 2009"
"Markets regain 17,000-level as metal, realty back in favour "," December 08, 2009"
Sensex up 78 pts in opening trade ," December 08, 2009"
Changing cultures within medicine ," December 08, 2009"
"Learning to change, for survival "," December 08, 2009"
"Metal, realty stocks suffer setback "," December 08, 2009"
Changing cultures within medicine ," December 08, 2009"
"Metal, realty stocks suffer setback "," December 07, 2009"
Decision on revival of Ennore LNG terminal in 2-3 months: IOC ," December 07, 2009"
Sensex gains 75 pts in opening trade ," December 07, 2009"
NSS volunteers urged to serve in villages; stress on rain harvesting ," December 07, 2009"
"Top 9 companies add Rs 49,000 cr in m-cap "," December 06, 2009"
"Ecopetrol, RIL to explore deepwater blocks in Colombia "," December 05, 2009"
"After NSE, BSE kicks off mutual funds platform "," December 04, 2009"
The biggest gap exists in the Internet access space ," December 04, 2009"
‘Centre’s secondary source of information cannot be accepted’ ," December 04, 2009"
Gas row: RNRL raises objections on Govt. affidavit ," December 03, 2009"
"NTPC and RNRL cannot be equated at par, Centre tells apex court "," December 03, 2009"
"India, Russia to ink key pacts during Singh’s Moscow visit "," December 02, 2009"
‘Govt cannot create new policies to frustrate old contracts’ ," December 02, 2009"
A unique institution in the making ," December 01, 2009"
"Sensex rally continues, regains 17,200-mark "," December 01, 2009"
A unique institution in the making ," December 01, 2009"
Reliance cuts SMS rates ," November 30, 2009"
Bharti Airtel bags ‘Best Global Wholesale Carrier’ award ," November 29, 2009"
Sensex tumbles by 223 pts on Dubai debt worries ," November 27, 2009"
Private oil firms seek fuel pricing freedom ," November 27, 2009"
Gas supply pact beneficial only to RIL: Jethmalani ," November 27, 2009"
RIL’s storage tanks opposed ," November 27, 2009"
Sensex sheds 340 points ," November 27, 2009"
Gas supply pact beneficial only to RIL: Jethmalani ," November 27, 2009"
Small steps to safe future ," November 27, 2009"
Sensex ducks below 17K level ," November 26, 2009"
Sensex down 57 points in early trade on Asian cues ," November 26, 2009"
‘MoU signed by Mukesh Ambani binding on RIL’ ," November 26, 2009"
Refineries get gas allocation ," November 26, 2009"
‘MoU signed by Mukesh Ambani binding on RIL’ ," November 25, 2009"
Refineries get gas allocation ," November 25, 2009"
"Sensex rebounds, up 48 points in opening trade "," November 25, 2009"
"RIL bound to implement MoU, a sacrosanct document: Jethmalani "," November 25, 2009"
"RIL bound to implement MoU, a sacrosanct document: Jethmalani "," November 24, 2009"
Sensex declines on weak global cues ," November 24, 2009"
"Sensex down 68 points; Nifty falls below 5,100 "," November 24, 2009"
On the rich list ," November 24, 2009"
Reliance Industries leads Sensex rally ," November 24, 2009"
"Economy, education key topics at India-US CEO meet "," November 23, 2009"
Sensex rises 102 points in opening trade ," November 23, 2009"
RIL bids for world’s third largest chemical firm ," November 23, 2009"
NBV wins National Energy Management Award ," November 23, 2009"
RIL bids for world’s 3rd largest chemical firm ," November 22, 2009"
‘Schoolympics- 2009’ concludes ," November 22, 2009"
RIL submits 'non-binding' offer to acquire LyondellBasell ," November 21, 2009"
"Ratan Tata, David Cote to co-chair Indo-US CEO Forum "," November 21, 2009"
Sensex up 236 points ," November 21, 2009"
Chief Justice Gokhale declares savings of Rs.38.78 lakh ," November 21, 2009"
Sensex makes smart comeback to post 236-points gain ," November 20, 2009"
Sensex down 118 points in opening trade on global cues ," November 20, 2009"
Sensex makes smart comeback to post 236-points gain ," November 20, 2009"
Sensex down 118 points in opening trade on global cues ," November 20, 2009"
Govt a party to conspiracy with RIL: Jethmalani ," November 20, 2009"
Six women in Forbes India rich list ," November 20, 2009"
Six women in Forbes India rich list ," November 20, 2009"
Cellphone numbers now similar to landline ones ," November 20, 2009"
Mukesh Ambani is richest Indian ," November 20, 2009"
Govt a party to conspiracy with RIL: Jethmalani ," November 20, 2009"
Six women in Forbes India rich list ," November 19, 2009"
Koda’s net assets worth nearly Rs 1 crore ," November 19, 2009"
Sensex down 70 points in early trade on Asian cues ," November 19, 2009"
Focus on using appropriate materials for better construction ," November 19, 2009"
