Headline,Posted
"Sensex down 70 points on profit-booking, mixed global trend "," July 05, 2011"
Fewer options for vehicle-users ," July 05, 2011"
FDI inflows jump in May ," July 05, 2011"
FDI shoots up 111% at $4.66 billion in May ," July 04, 2011"
Sensex ends 52 points up ," July 04, 2011"
Reliance Retail poaches Walmart execs to head value format ," July 04, 2011"
Fewer options for vehicle-users ," July 04, 2011"
"Sensex continues to rule firm, up by 88 points "," July 04, 2011"
Fewer options for vehicle-users ," July 04, 2011"
Nokia in a churn ," July 03, 2011"
CBI registers FIR against V.K. Sibal ," July 02, 2011"
Sensex snaps six-day rally ," July 02, 2011"
Sensex snaps six-day rally ," July 02, 2011"
Iran puts pressure on Indian oil firms over payment ," July 01, 2011"
Sensex snaps 6-day rally on profit-booking; down 83 points ," July 01, 2011"
CBI registers FIR against V.K. Sibal ," July 01, 2011"
Kiran's plea on natural gas ," July 01, 2011"
Sensex up 152 points on easing inflation ," June 30, 2011"
Nannaya University to offer ‘individualised education' ," June 30, 2011"
“There are mechanisms to correct irregularities” ," June 30, 2011"
The Art and Science of Managementat Rathinam Campus ," June 30, 2011"
“There are mechanisms to correct irregularities” ," June 30, 2011"
Nannaya University to offer ‘individualised education' ," June 30, 2011"
Sensex jumps 201 points to two-month high ," June 29, 2011"
"""Knowledge management needs to be given its due"" "," June 29, 2011"
CAG refutes ‘charge' that it did not consult RIL ," June 29, 2011"
CAG refutes ‘charge' that it did not consult RIL ," June 28, 2011"
CAG refutes ‘charge' that it did not consult RIL ," June 27, 2011"
"Sensex up 172 points, oil companies surge on fuel price hike "," June 27, 2011"
Take part in movement against corruption: Kalam ," June 27, 2011"
Take part in movement against corruption: Kalam ," June 26, 2011"
Bias in favour of ‘khas aadmi': AIDWA ," June 26, 2011"
Bias in favour of ‘khas aadmi': AIDWA ," June 26, 2011"
Bias in favour of ‘khas aadmi’: AIDWA ," June 25, 2011"
Chinese prime minister visiting Europe ," June 25, 2011"
Mukesh Ambani calls on Manmohan ," June 25, 2011"
Mukesh Ambani calls on Manmohan ," June 24, 2011"
"Sensex up 513 pts on oil prices, global cues; regains 18K mark "," June 24, 2011"
Government cold to CAG's quest for new powers ," June 24, 2011"
Government cold to CAG's quest for new powers ," June 24, 2011"
Sensex spurts by 177 points on value buying ," June 23, 2011"
RIL gesture ," June 23, 2011"
Sensex dips 10 points on monsoon worries ," June 22, 2011"
‘Naidu must apologise to Telangana people' ," June 22, 2011"
Late selling trims gains in Sensex ," June 22, 2011"
We will approach CAG draft report with an open mind: Jaipal Reddy ," June 21, 2011"
Sensex tumbles 364 points to 17507 ," June 21, 2011"
We will approach CAG draft report with an open mind: Jaipal Reddy ," June 20, 2011"
China’s Three Gorges Corp. defends huge dam from critics ," June 20, 2011"
"CAG report on KG basin contract vindicates our stand, says CPI(M) "," June 18, 2011"
"Don't jump to conclusions, says Petroleum Ministry "," June 18, 2011"
"Don't jump to conclusions, says Petroleum Ministry "," June 18, 2011"
"CAG report on KG basin contract vindicates our stand, says CPI(M) "," June 18, 2011"
Chidambaram should be removed: Joshi ," June 18, 2011"
Sensex dropsto 3-week low ," June 18, 2011"
A Vibrant Management Institution in Tiruchi ," June 18, 2011"
Chidambaram should be removed: Joshi ," June 17, 2011"
Sensex down 115 points as losing streak continues ," June 17, 2011"
Mapping the sun's potential to power New York ," June 17, 2011"
CPI(M) seeks statement from Manmohan on CAG report ," June 17, 2011"
Mapping the sun's potential to power New York ," June 17, 2011"
CBI probe sought into KG basin operations ," June 17, 2011"
When small is BIG! ," June 17, 2011"
CPI(M) seeks statement from PM on CAG report ," June 16, 2011"
Oil Ministry calls for restraint on CAG report on KG-D6 ," June 16, 2011"
Sensex tumbles 146 points on RBI rate hike ," June 16, 2011"
"Sensex dips below 18,000 points as RBI hikes rates "," June 16, 2011"
All's not well with gas and oil ," June 16, 2011"
"Ramachandran Raja, RIL apologise to Chidambaram "," June 16, 2011"
Advance tax payout of top 100 firms up 14 % in Q1 ," June 16, 2011"
"Ramachandran Raja, RIL apologise to Chidambaram "," June 16, 2011"
All's not well with gas and oil ," June 16, 2011"
‘PMO turned blind eye to repeated warnings' ," June 16, 2011"
PM should explain Chidambaram's ‘role': BJP ," June 16, 2011"
Tata companies invited for industry meet on June 18 ," June 16, 2011"
"Ramachandran Raja, RIL apologise to Chidambaram "," June 16, 2011"
All's not well with gas and oil ," June 16, 2011"
Advance tax payout of top 100 firms up 14 % in Q1 ," June 16, 2011"
RIL-BP deal gets Home Ministry nod ," June 16, 2011"
Home Ministry gives nod to the $7.2 billion RIL-BP deal ," June 15, 2011"
"‘PMO turned blind eye to repeated warnings on Reliance, Cairn' "," June 15, 2011"
"Oil, gas-sharing contracts favour private players: CAG "," June 15, 2011"
Congress surprised at leak of CAG report on RIL ," June 15, 2011"
"CBI pursuing two-year-old probe into role of Oil Ministry, DGH "," June 15, 2011"
Letters to theeditor ," June 15, 2011"
Congress surprised at leak of CAG report on RIL ," June 15, 2011"
"CBI pursuing probe into role of Oil Ministry, DGH "," June 15, 2011"
"CBI pursuing probe intorole of Oil Ministry, DGH "," June 15, 2011"
Congress surprised at leak of CAG report on RIL ," June 15, 2011"
Letters to theeditor ," June 15, 2011"
"‘PMO turned blind eye to repeated warnings on Reliance, Cairn' "," June 15, 2011"
"Oil, gas-sharing contracts favour private players: CAG "," June 15, 2011"
"With CAG storm brewing for RIL, Jaipal meets Manmohan "," June 15, 2011"
"With CAG storm brewing for RIL, Jaipal meets Manmohan "," June 14, 2011"
“Undue benefit to Reliance is huge but can't be quantified” ," June 14, 2011"
Apparel maker VF to acquire Timberland in $2 b deal ," June 14, 2011"
“Ministry examining CAG draft report” ," June 14, 2011"
"Don't issue statements on wealth, BJP tells Ramdev "," June 14, 2011"
Late recovery in Sensex ," June 14, 2011"
‘Trained apparel designers in good demand' ," June 14, 2011"
“Undue benefit to Reliance is huge but can't be quantified” ," June 14, 2011"
“Ministry examining CAG draft report” ," June 14, 2011"
"RIL got ‘huge, undue benefit' at taxpayers' expense "," June 14, 2011"
Apparel maker VF to acquire Timberland in $2 b deal ," June 14, 2011"
Eye for design ," June 14, 2011"
"RIL got ‘huge, undue benefit' at taxpayers' expense "," June 13, 2011"
Fashion means business ," June 13, 2011"
Sensex ends 3 points down on inflation worries ," June 13, 2011"
Sensex ends 3 points down on inflation worries ," June 13, 2011"
Government to act against RIL for not adhering to gas plan ," June 12, 2011"
Government to act against RILfor not adhering to gas plan ," June 12, 2011"
Mamata to meet Anil Ambani ," June 12, 2011"
Shine on Sowcar ," June 12, 2011"
Shine on Sowcar ," June 12, 2011"
Shine on Sowcar ," June 12, 2011"
Shine on Sowcar ," June 12, 2011"
Shine on Sowcar ," June 12, 2011"
Shine on Sowcar ," June 12, 2011"
Small is BIG! ," June 12, 2011"
Government to act against RIL fornot adhering to gas plan ," June 12, 2011"
Shine on Sowcar ," June 12, 2011"
Shine on Sowcar ," June 12, 2011"
Govt. to act against Mukesh Ambani's RIL for not adhering to gas plan ," June 12, 2011"
Bharti sells entire stake in insurance JVs with AXA to RIL ," June 11, 2011"
Bharti sells entire stake in insurance JVs with AXA to RIL ," June 10, 2011"
Small is BIG! ," June 10, 2011"
SBI breaches RBI norms on RIL exposure for 3rd straight year ," June 10, 2011"
Sensex eases further by 49 points on weak global cues ," June 10, 2011"
Sensex ends flat ," June 10, 2011"
Shine on ," June 10, 2011"
Small is BIG! ," June 10, 2011"
Small is BIG! ," June 10, 2011"
TCS briefly topples ONGC to become third most valuable company ," June 08, 2011"
"Sensex snaps two-day gains, down 101 points "," June 08, 2011"
"Natural gas is no climate change ‘panacea,' warns IEA "," June 08, 2011"
"Natural gas is no climate change ‘panacea,' warns IEA "," June 08, 2011"
Sensex up on firm global markets ," June 08, 2011"
Sensex recovers marginally after initial losses ," June 07, 2011"
Why do farmers commit suicide? ," June 07, 2011"
95 p.c. NIT Warangalstudents get placements ," June 07, 2011"
EGoM meet on gas allocation cancelled ," June 07, 2011"
EGoM meet on gas allocation cancelled ," June 06, 2011"
CNG prices marginally hiked in Delhi ," June 05, 2011"
CNG prices up in Delhi ," June 05, 2011"
World Environment Day celebrated ," June 05, 2011"
CNG prices marginally hiked in Delhi ," June 05, 2011"
CNG prices up in Delhi ," June 05, 2011"
‘Not contemplating banking foray' ," June 04, 2011"
"Reliance Industries to focuson retail, telecom businesses "," June 04, 2011"
Sensex dips 118 points to 18376 ," June 04, 2011"
RIL pulls down Sensex by 119 points ," June 03, 2011"
"RIL conceptualising products, services for mobile broadband "," June 03, 2011"
Reliance Retail to enter wholesale business soon: Ambani ," June 03, 2011"
Sensex gains 133 points in opening trade ," June 03, 2011"
Sensex drops 115 points ," June 03, 2011"
Japan evaluating townshipproject in Haryana ," June 03, 2011"
Bangaloretoday ," June 03, 2011"
Report of probe into RIL eastern offshore fields by monsoon session: CAG ," June 02, 2011"
"Sensex shrugs off poor GDP data, jumps 271 points on global cues "," May 31, 2011"
Climate change: Rising greenshouse gas emissions trigger wake-up call ," May 31, 2011"
R&D the cornerstone of RINL ," May 31, 2011"
"Sensex slips 34 points on profit booking, inflation fears "," May 30, 2011"
EGoM on natural gas allocation on June 9 ," May 30, 2011"
"Old, new operators spar over termination charges "," May 29, 2011"
"Five of top 10 companies add over Rs 35,000 cr in m-cap, CIL top gainer "," May 29, 2011"
30 corporate honchos get Rs 1 crore-plus salary ," May 29, 2011"
Be a superstar ," May 29, 2011"
VA Tech brimming with orders ," May 28, 2011"
VA Tech brimming with orders ," May 28, 2011"
Sensex up 221 points on firming global trend ," May 27, 2011"
Sensex advances further by 142 points on higher Asian cues ," May 27, 2011"
Making films with soul ," May 27, 2011"
Sensex recovers ," May 27, 2011"
Sensex jumps 197 points on high earnings ," May 26, 2011"
Sensex plunges to nine-week low ," May 25, 2011"
Sensex down 68 points on weak Asian cues ," May 25, 2011"
Sensex regains 18000-mark ," May 25, 2011"
248366: Scenesetter for Codel Kerry's visit to India ," May 24, 2011"
“IITs' success because of students” ," May 24, 2011"
“IITs' success because of students” ," May 24, 2011"
“IITs' success because of students” ," May 24, 2011"
Sensex down 168 points on weak Asian cues ," May 23, 2011"
Bhagavata Mela: critical link to Sanskrit theatre ," May 21, 2011"
RIL mulls mobilisation of $1.5 b loans ," May 21, 2011"
RIL mulls mobilisation of $1.5 b loans ," May 20, 2011"
Sensex gains 55 points ," May 20, 2011"
"Sensex snaps three-day losing streak, closes 55 points higher "," May 19, 2011"
Reliance rebuts DGH's KG-D6 report ," May 19, 2011"
Sensex continues to decline ," May 19, 2011"
Reliance rebuts DGH's KG-D6 report ," May 18, 2011"
11.1 mn GSM users added in April: COAI ," May 18, 2011"
Sensex falls 51 points on interest rate concerns ," May 18, 2011"
Mukesh Ambani gets fresh BoA shares worth Rs.72 lakh ," May 17, 2011"
Sensex closes 208 points down ," May 17, 2011"
‘Reliance Super' inaugurated ," May 14, 2011"
From the diary ," May 14, 2011"
Oil Ministry to meet non-core users of KG-D6 gas today ," May 11, 2011"
Supreme Court clears deck for prosecution of Reliance executives ," May 10, 2011"
Sensex ends 16 points down in volatile trading ," May 10, 2011"
Reliance to partner with more global players in financial business: Ambani ," May 10, 2011"
Mukesh Ambani forgoes Rs.23.75 crore from salary ," May 10, 2011"
Lacklustre trading in equities ," May 10, 2011"
Mukesh Ambani forgoes Rs. 23.75 cr from salary ," May 09, 2011"
Sensex marginally up on selective buying at lower levels ," May 09, 2011"
Reliance cuts natural gas supplies to non-core users ," May 09, 2011"
Ajit Singh in talks with Congress on poll alliance ," May 08, 2011"
Ajit Singh admits talks with Congress on poll alliance ," May 08, 2011"
Sale of gold coins picks up in post offices ," May 07, 2011"
Sensex spurts 308 points amid easing oil rates ," May 06, 2011"
Sensex down 65 points; continues decline for the eighth day ," May 04, 2011"
"Sensex tanks 463 points as RBI hikes rates, projects lower growth "," May 03, 2011"
Reliance Industries asked to come out with new plan to drill more wells ," May 03, 2011"
Chaturvedi is new Petroleum Secretary ," May 03, 2011"
Chaturvedi is new Petroleum Secretary ," May 02, 2011"
Reliance Industries asked to come out with new plan to drill more wells ," May 02, 2011"
Applying the BCCL model to revive Haldia Petrochem ," May 02, 2011"
Applying the BCCL model to revive Haldia Petrochem ," May 02, 2011"
Applying the BCCL model to revive Haldia Petrochem ," May 02, 2011"
Honour for Sri Vishnu Educational Society ," May 02, 2011"
Sensex closes 156 points down ," April 29, 2011"
"Sensex down 157 points, falls for fourth day in a row "," April 28, 2011"
RIL asked to stop gas supply to non-core sectors ," April 28, 2011"
Sensex posts further losses ," April 28, 2011"
RIL asked to stop gas supply to non-core sectors ," April 27, 2011"
Sensex closes 97 points below ," April 27, 2011"
An alternative to nuclear power ," April 27, 2011"
DGH to probe decline in gas output from KG-D6 fields ," April 27, 2011"
An alternative to nuclear power ," April 27, 2011"
Sensex ends 39 points down ," April 26, 2011"
Sensex tumbles by 200 points on weak Asian cues ," April 26, 2011"
"India willing to export petrol, diesel to Pakistan "," April 26, 2011"
"India willing to export petrol, diesel to Pakistan "," April 26, 2011"
Late selling pulls down Sensex ," April 26, 2011"
Oil Minister orders RIL to stop KG-D6 gas supply to non-core users ," April 25, 2011"
Sensex down 18 points in dull trading ," April 25, 2011"
Genco power plant on course ," April 25, 2011"
"VSU, KPCL to start engineering college "," April 25, 2011"
‘Mukesh Ambani's house gets 5 lakh litres of water a month' ," April 24, 2011"
‘Mukesh Ambani's house gets 5 lakh litres of water a month' ," April 24, 2011"
RIL to make use of DE Shaw's expertise ," April 23, 2011"
"Mall, multiplex and modern life "," April 23, 2011"
RIL to make use of DE Shaw's expertise ," April 23, 2011"
"Mall, multiplex and modern life in Kozhikode "," April 23, 2011"
RIL to make use of DE Shaw's expertise ," April 22, 2011"
The world of Bollywood as seen through American diplomatic eyes ," April 22, 2011"
248356: Can the Indian film industry go global? ," April 22, 2011"
248355: The Bollywood-Hollywood partnership ," April 22, 2011"
The world of Bollywood as seen through American diplomatic eyes ," April 22, 2011"
Sensex up 131 points on global cues ," April 22, 2011"
"Reliance net up 25 % at Rs.20,286 crore "," April 22, 2011"
Discovers gas in Cauvery-Palar basin ," April 22, 2011"
Reliance discovers gas in Cauvery-Palar basin ," April 21, 2011"
"Reliance net up 25 % at Rs.20,286 crore "," April 21, 2011"
Sensex gains 131 points ," April 21, 2011"
"Sensex 164 points up ahead of RIL, TCS Q4 results "," April 21, 2011"
Sensex shoots up 349 points on monsoon outlook ," April 20, 2011"
DGH rejects RIL spending plan ," April 20, 2011"
DGH rejects RIL spending plan ," April 19, 2011"
Sensex gains 31 points ," April 19, 2011"
Making children eco-conscious ," April 19, 2011"
Earth Week celebrated ," April 19, 2011"
All about IT ," April 19, 2011"
Sensex falls 296 points amid weak global trends ," April 18, 2011"
"Sensex erases initial gains, down 176 points "," April 18, 2011"
Accidents dent VSP's image ," April 18, 2011"
China's steel output growth to slow ," April 17, 2011"
Bangalore today ," April 15, 2011"
RIL starts world-scale polyester projects ," April 14, 2011"
RIL to begin implementation of world scale polyester projects ," April 13, 2011"
Transocean claims record ocean depth for oil drilling ," April 13, 2011"
Plan for uninterrupted power to industries ," April 13, 2011"
Transocean claims record ocean depth for oil drilling ," April 12, 2011"
Poor IIP data pull down Sensex ," April 12, 2011"
Sensex falls 189 points on low industrial output ," April 11, 2011"
What counts at the Civils interview ," April 11, 2011"
Sensex slips by 21 points ," April 07, 2011"
Sensex down 75 points in volatile trade ," April 06, 2011"
Sensex drops 15 points on profit booking ," April 05, 2011"
Role of telecom engineering services ," April 05, 2011"
RIL SEZ gets only one year extension ," April 05, 2011"
RIL SEZ gets only one year extension ," April 04, 2011"
"Sensex moves up 281 points to 3-month high; Nifty regains 5,900 "," April 04, 2011"
Sensex up 75 points in early trade on strong FII buying ," April 04, 2011"
FDI policy: Opening the floodgates ," April 04, 2011"
A peep inside the Civils interview room ," April 04, 2011"
116877: New Delhi weekly Econ office highlights ," April 03, 2011"
"Radia, Vahanvati among 125 witnesses "," April 03, 2011"
"Shops shut, lanes barricaded "," April 03, 2011"
"Radia, Vahanvati among 125 witnesses "," April 03, 2011"
Shops shut and lanes barricaded ," April 03, 2011"
Sensex down 25 points on profit booking ," April 01, 2011"
buylines ," March 31, 2011"
"Chandigarh gears up for influx of VVIPs, fans "," March 30, 2011"
"Chandigarh gears up for influx of VVIPs, fans "," March 30, 2011"
Cricket mania all the way ," March 30, 2011"
China lowering nuclear target ," March 29, 2011"
Global energy giants stay away from NELP IX ," March 29, 2011"
Global energy giants stay away from NELP IX ," March 28, 2011"
"Reliance Industries to enter financial services business, floats joint venture with DE Shaw group "," March 28, 2011"
‘Court ruled against RIL' ," March 27, 2011"
Sensex up 281 points; blue chips lead the rally ," March 23, 2011"
Sensex gains on global cues ," March 22, 2011"
84043: Modi sets his eyes on national politics ," March 22, 2011"
Sensex falls 40 points in choppy trade ," March 21, 2011"
35111: Scenesetter for Mukherjee’s visit to the States ," March 21, 2011"
VSU plans to ink MoU with SPKM IIHT ," March 21, 2011"
Fire at RIL yarn godown ," March 20, 2011"
Gas supplies reach plants ," March 20, 2011"
"House sites to MLAs, MPs: review petition dismissed "," March 19, 2011"
Gas supplies reach plants ," March 19, 2011"
RIL estimates further drop in gas production ," March 19, 2011"
Steep fall in Sensex ," March 19, 2011"
RIL estimates further drop in gas production ," March 18, 2011"
Sensex dips again; down 271 points ," March 18, 2011"
"GAIL, RIL in swap deal for LNG "," March 18, 2011"
"GAIL, RIL in swap deal for LNG "," March 17, 2011"
Sensex falls 209 points as RBI hikes key rates ," March 17, 2011"
No power cut for industries ," March 17, 2011"
"Sensex up 191 points on easing oil prices, growth expectations "," March 16, 2011"
Sensex up 223 points on hopes of strong Q4 results in morning trade ," March 16, 2011"
Ryots ‘power-less': Naidu ," March 16, 2011"
Power demand on the rise: Minister ," March 16, 2011"
Sensex drops 272 points on panic selling ," March 16, 2011"
Sensex closes 272 points down amid Japan nuke leak fears ," March 15, 2011"
Sensex closes 272 points down amid Japan nuke leak fears ," March 15, 2011"
Pro-U.S. tilt in Cabinet shuffle ," March 15, 2011"
51088: UPA cabinet shuffle good for America ," March 15, 2011"
Pro-U.S. tilt in Cabinet shuffle ," March 15, 2011"
MRTP panel being wound up ," March 15, 2011"
Sensex rebounds 265 points ," March 15, 2011"
Sensex up 265 points ," March 14, 2011"
"No night power cuts, says Kiran "," March 14, 2011"
Stress on green computing to protect earth ," March 14, 2011"
India set to shine in aerospace markets ," March 14, 2011"
Kiran speaks to Jaipal Reddy on gas supply to power projects ," March 13, 2011"
Sensex falls by 154 points on lower factory output ," March 11, 2011"
Carlos Slim remains world'srichest person: Forbes ," March 11, 2011"
Carlos Slim remains world's richest person: Forbes ," March 11, 2011"
Carlos Slim remains world’s richest person: Forbes ," March 10, 2011"
Reliance needs to drill two more wells by April: DGH ," March 10, 2011"
Sensex extends gains ," March 10, 2011"
‘RIL needs to drill 2 more wells by April' ," March 10, 2011"
Sensex ends moderately higher in volatile trade ," March 09, 2011"
Haryana Power Corporation faces CAG flak for poor show ," March 09, 2011"
CISF to upgrade security at airports across country ," March 09, 2011"
Sensex recovers 217 points on easing political concerns ," March 08, 2011"
CISF to upgrade security at airports ," March 08, 2011"
Sibal to hold crucial telecom meet today ," March 08, 2011"
LIC new business premium collection up 37 per cent ," March 07, 2011"
Striving for a balanced growth ," March 07, 2011"
bangalore today ," March 07, 2011"
Striving for a balanced growth ," March 06, 2011"
Students urged to face challenges ," March 06, 2011"
IIM-K campus placement offers go up ," March 06, 2011"
Debates on gas-based power projects ," March 06, 2011"
Shaikpet a new destination for shopping ," March 06, 2011"
IIM-K campus placement offers up ," March 05, 2011"
Young Indians to speak on ‘Ushering change' today ," March 05, 2011"
Sensex ends flat as profit-booking erases early gains ," March 04, 2011"
Poised for further growth and success ," March 04, 2011"
Poised for further growth and success ," March 04, 2011"
India resumes payment to Iran for crude oil import ," March 03, 2011"
"Sensex gains 43 points on easing oil prices, food inflation "," March 03, 2011"
Realty firm questioned for ‘links' with ADAG ," March 03, 2011"
Kapil Dev launches radio channel ," March 03, 2011"
Blind development will hurt ecology and health: Jairam ," March 03, 2011"
Blind development will hurt ecology and health: Jairam ," March 03, 2011"
Realty firm questioned for ‘links' with ADAG ," March 03, 2011"
Wide swings in Sensex ," March 01, 2011"
Wide swings in Sensex ," February 28, 2011"
"RIL pares gains, sheds 0.10 per cent on BSE "," February 28, 2011"
RBI to issue guidelines on new banking licences by March-end ," February 28, 2011"
RIL seeks Oil Ministry nod for stake sale to BP ," February 26, 2011"
Bangalore today ," February 26, 2011"
Survey bats for banking licences for industrial houses ," February 25, 2011"
Partnership for the deep waters ," February 25, 2011"
Partnership for the deep waters ," February 24, 2011"
Australia plans carbon tax on polluters from 2012 ," February 24, 2011"
Late selling pulls down Sensex by 118 points ," February 24, 2011"
"Sensex falls on concerns over oil prices, interest rate "," February 23, 2011"
Green thoughts ," February 23, 2011"
Airport Express Corridor opens; reach IGI in 18 minutes ," February 23, 2011"
"Niko can raise stake by 30 %, says RIL "," February 23, 2011"
Sensex declines 142 points ," February 23, 2011"
Airport Express to begin commercial operation today ," February 23, 2011"
Sensex declines 142 points ," February 23, 2011"
"Niko can raise stake by 30 %, says RIL "," February 23, 2011"
Seminar on e-governance from Feb. 26 ," February 23, 2011"
BP deal augurs well for RIL ," February 23, 2011"
BP deal augurs well for RIL ," February 22, 2011"
Sensex declines 142 points ," February 22, 2011"
$7.2 bn BP deal: ONGC’s loss is Reliance gain ," February 22, 2011"
Sensex opens 155 points lower on profit-booking ," February 22, 2011"
"BP inks mega deal to pick up 30 % in RIL oil, gas blocks for $7.2 billion "," February 22, 2011"
Reliance sells stake in oil blocks to BP ," February 22, 2011"
"BP inks mega deal to pick up 30 % in RIL oil, gas blocks for $7.2 billion "," February 22, 2011"
Sensex up sharply by 227 points; IT led the rally ," February 21, 2011"
"First convocation of Anna University of Technology, Coimbatore held "," February 21, 2011"
"First convocation of Anna University of Technology, Coimbatore held "," February 21, 2011"
It's time to get down to business ," February 19, 2011"
It's time to get down to business ," February 19, 2011"
Sensex snaps five-day gaining streak ," February 19, 2011"
Webel partners Reliance Animation ," February 19, 2011"
Webel partners Reliance Animation ," February 18, 2011"
Sensex opens 31 points lower on profit-booking ," February 17, 2011"
"Huge gap in cardiac care, says Prathap Reddy "," February 17, 2011"
Jaipal Reddy dedicates IOC naphtha cracker complex to the nation ," February 16, 2011"
Jaipal Reddy dedicates IOC naphtha cracker complex to the nation ," February 16, 2011"
Fresh gains in Sensex ," February 16, 2011"
Fresh gains in Sensex ," February 15, 2011"
"Sensex down 40 points on selling in realty, CG counters "," February 15, 2011"
DRDO crosses Rs.1 lakh crore-mark in production value ," February 15, 2011"
RCom profit at Rs.480 crore ," February 15, 2011"
RCom profit at Rs.480 crore ," February 15, 2011"
DRDO crosses Rs.1 lakh crore-mark in production value ," February 15, 2011"
"We went by DoT regulations, says RCom "," February 14, 2011"
"We went by DoT regulations, says RCom "," February 13, 2011"
