,Headlines,Date
0,Reliance Foundation seeks govt nod to import J&J Covid vaccine doses for its workforce in India,04 Jun 2021 
1,"Amid pandemic, RIL Chairman Mukesh Ambani draws nil salary",03 Jun 2021 
2,"'RIL earnings momentum set to improve, these 3 events can add over Rs 500 to share price'",03 Jun 2021 
3,"Adani, Tata, L&T vying to build Lithium ion business under govt's PLI scheme: Report", 03 Jun 2021
4,Mukesh Ambani says Reliance now has strong balance sheet to support growth,02 Jun 2021 
5,"Reliance Industries turns top gainer with 6% rally, helps Nifty clock record high",28 May 2021 
6,"D-Street Buzz: Over 250 stocks hit new 52-week high on BSE; RIL, Tata Steel, Eicher Motors top gainers", 28 May 2021
7,"Reliance Industries launches India’s largest private COVID vaccination drive; to give free jabs to over 1.3 million employees, their families",27 May 2021 
8,RIL share price rises after Jio announces 2 offers for its customers, 14 May 2021
9,"Reliance Consolidated March 2021 Net Sales at Rs 154,896.00 crore, up 13.69% Y-o-Y",04 May 2021 
10,"Reliance Standalone March 2021 Net Sales at Rs 85,977.00 crore, up 16.25% Y-o-Y",04 May 2021 
11,"What should investors do with RIL post Q4 earnings; buy, sell or hold?",03 May 2021 
12,Dalal Street Week Ahead: Here are 10 key factors that will keep traders busy next week,02 May 2021 
13,Reliance becomes India’s largest producer of medical grade liquid oxygen from single location,01 May 2021 
14,Reliance Industries Q4FY21: Strong contribution from digital businesses likely to offset probable weakness in cyclical sectors, 30 Apr 2021
15,"Reliance Retail reports 45% YoY jump in Q4 profit at Rs 2,247 crore",30 Apr 2021 
16,"Reliance Jio Q4 profit jumps 47.5% YoY to Rs 3,508 cr, ARPU stands at Rs 138.2",30 Apr 2021 
17,"RIL Q4 profit more than doubles to Rs 13,227 crore, firm posts record annual profit of Rs 53,739 crore",30 Apr 2021 
18,RIL to announce Q4 numbers today: Revenue expected to grow in double digits,30 Apr 2021 
19,Indian markets dangerously resist virus resurgence, 29 Apr 2021
20,"IOC, BPCL to supply oxygen to hospitals in Delhi, Haryana, Punjab",19 Apr 2021 
21,RIL share price rises on signing spectrum agreement with Bharti Airtel,07 Apr 2021 
22,"Reliance Industries to cover COVID-19 vaccination costs of employees, families",05 Mar 2021 
23,RIL subsidiary acquires additional stake in skyTran; share price gains,01 Mar 2021 
24,Gelatin sticks for explosives: Terror angle not ruled out in Mukesh Ambani threat case,27 Feb 2021 
25,RIL oil-to-chemicals spin-off: Morgan Stanley overweight on the stock,23 Feb 2021 
26,Reliance to spin off O2C biz into 100% subsidiary,23 Feb 2021 
27,"Tata Group to buy 68% stake in BigBasket for over Rs 9,000 crore",16 Feb 2021 
28,Market cap of seven of top-10 most valuable firms jump over Rs 1.40 lakh crore, 14 Feb 2021
29,RIL share price rises after Delhi High Court lifts 'Status Quo' order of Reliance-Future deal,09 Feb 2021 
30,"Reliance buys two-thirds of own gas from KG-D6; GAIL, Shell among other buyers", 07 Feb 2021
31,Reliance Industries gets world's first 'carbon-neutral' oil from US,04 Feb 2021 
32,Future Group to challenge court order blocking its retail deal in dispute with Amazon, 03 Feb 2021
33,Nine of 10 most valued firms take over Rs 3.96 lakh crore hit in market cap, 31 Jan 2021
34,"Energy sector hit by COVID-19, price stability crucial: Mukesh Ambani at Saudi's FII conference", 27 Jan 2021
35,TCS pips Accenture to become the world's most valued IT firm,25 Jan 2021 
36,"What should investors do with Reliance Industries after Q3 result: buy, sell or hold?",25 Jan 2021 
37,M-cap of 4 of top-10 valued firms jumps over Rs 1.15 lakh crore, 24 Jan 2021
38,"RIL Q3: Profit up 40% on robust revival in O2C, retail segments; Jio ARPU grows to Rs 151",22 Jan 2021 
39,"Taking Stock | Profit-booking drags Nifty below 14,400, Sensex plunges over 700 pts",22 Jan 2021 
